,id,year,title,keywords,abstract,copyright,AU,SO,DE,DOI
107,WOS:000384333000001,2016,"Gulf war contamination assessment for optimal monitoring and remediation cost-benefit analysis, Kuwait",RAUDHATAIN,"Site characterization was performed on an area of  km() around the strategically vital freshwater aquifers of the Al-Rawdhatain and Umm Al-Aish to assess the status of groundwater pollution as the result of Iraq invasion to Kuwait in . Advanced data analysis and visualization software (EVS-Pro) was used for groundwater contamination assessment analytes: total petroleum hydrocarbon (TPH) and total dissolved solids (TDS). This will reduce the number of samples needed (saves time and money) and provide a superior assessment of the analytes distribution. Based on the ""minimum-maximum plume technology'' analysis, the nominal plume area with a threshold of . mg/kg TPH is estimated at about . km . This is the difference between the maximum and minimum predicted plume sizes. EVS-Pro also computed . x () and . x () for the plume volumes and masses (dollars per volume and mass), respectively. Also, new sampling locations were determined for further detailed site assessments based on the confidence and uncertainty analysis, which is more defensible and cost-optimized approach. This will reduce the number of samples needed (saves time and money) and provide a superior assessment of the analytes distribution. These tools prove to be effective in assessing remediation costs of clean-up versus benefits obtained and in developing a cost-effective monitoring programme for insights into processes controlling subsurface contaminant transport that impact water quality.",,"Yihdego, Yohannes|Al-Weshah, Radwan A.",ENVIRONMENTAL EARTH SCIENCES,visualization|data analysis|site investigation|plume|monitoring|remediation|hydrocarbon|clean-up cost|pollution,10.1007/s12665-016-6025-3
108,WOS:000303035400007,2012,Comparison of different uncertainty techniques in urban stormwater quantity and quality modelling,FORMAL BAYESIAN METHOD|SENSITIVITY-ANALYSIS|STREAMFLOW SIMULATION|HYDRAULIC-PROPERTIES|GLUE APPROACH|WATER|OPTIMIZATION|CALIBRATION|PARAMETER|QUANTIFICATION,"Urban drainage models are important tools used by both practitioners and scientists in the field of stormwater management. These models are often conceptual and usually require calibration using local datasets. The quantification of the uncertainty associated with the models is a must, although it is rarely practiced. The International Working Group on Data and Models, which works under the IWA/IAHR Joint Committee on Urban Drainage, has been working on the development of a framework for defining and assessing uncertainties in the field of urban drainage modelling. A part of that work is the assessment and comparison of different techniques generally used in the uncertainty assessment of the parameters of water models. This paper compares a number of these techniques: the Generalized Likelihood Uncertainty Estimation (GLUE), the Shuffled Complex Evolution Metropolis algorithm (SCEM-UA), an approach based on a multi-objective auto-calibration (a multialgorithm, genetically adaptive multi-objective method, AMALGAM) and a Bayesian approach based on a simplified Markov Chain Monte Carlo method (implemented in the software MICA). To allow a meaningful comparison among the different uncertainty techniques, common criteria have been set for the likelihood formulation, defining the number of simulations, and the measure of uncertainty bounds. Moreover, all the uncertainty techniques were implemented for the same case study, in which the same stormwater quantity and quality model was used alongside the same dataset. The comparison results for a well-posed rainfall/runoff model showed that the four methods provide similar probability distributions of model parameters, and model prediction intervals. For ill-posed water quality model the differences between the results were much wider; and the paper provides the specific advantages and disadvantages of each method. In relation to computational efficiency (i.e. number of iterations required to generate the probability distribution of parameters), it was found that SCEM-UA and AMALGAM produce results quicker than GLUE in terms of required number of simulations. However, GLUE requires the lowest modelling skills and is easy to implement. All non-Bayesian methods have problems with the way they accept behavioural parameter sets, e.g. GLUE, SCEM-UA and AMALGAM have subjective acceptance thresholds, while MICA has usually problem with its hypothesis on normality of residuals. It is concluded that modellers should select the method which is most suitable for the system they are modelling (e.g. complexity of the model's structure including the number of parameters), their skill/knowledge level, the available information, and the purpose of their study. (C) ", Elsevier Ltd. All rights reserved.,"Dotto, Cintia B. S.|Mannina, Giorgio|Kleidorfer, Manfred|Vezzaro, Luca|Henrichs, Malte|McCarthy, David T.|Freni, Gabriele|Rauch, Wolfgang|Deletic, Ana",WATER RESEARCH,urban drainage models|uncertainties|parameter probability distributions|bayesian inference|glue|scem-ua|mica|amalgam|mcmc|multi-objective auto-calibration,10.1016/j.watres.2012.02.009
109,WOS:000244170000035,2007,Economic modelling of price support mechanisms for renewable energy: Case study on Ireland,,"The Irish Government is considering its future targets, policy and programmes for renewable energy for the period beyond . This follows a review in  of policy options that identified a number of different measures to stimulate increased deployment of renewable energy generation capacity. This paper expands this review with an economic analysis of renewable energy price support mechanisms in the Irish electricity generation sector. The focus is on three primary price support mechanisms quota obligations, feed in tariffs and competitive tender schemes. The Green-X computer model is utilised to characterise the RES-E potential and costs in Ireland up until, and including, . The results from this dynamic software tool are used to compare the different support mechanisms in terms of total costs to society and the average premium costs relative to the market price for electricity. The results indicate that in achieving a % RES-E proportion of gross electricity consumption by , a tender scheme provides the least costs to society over the period - but only in case there is limited or no strategic bidding. Considering, however, strategic bidding, a feed-in tariff can be the more efficient solution. Between the other two support mechanisms, the total costs to society are highest for feed-in-tariffs (FIT) until , at which point the costs for the quota system begin to rise rapidly and overtake FIT in -. The paper also provides a sensitivity analysis of the support mechanism calculations by varying default parameters such as the interim () target, the assumed investment risk levels and the amount of biomass co-firing. This analysis shows that a  target of % rather than .% generates lower costs for society over the whole period -, but higher costs for the RES-E strategy over the period -.", (c) 2006 Published by Elsevier Ltd.,"Huber, Claus|Ryan, Lisa|O Gallachoir, Brian|Resch, Gustav|Polaski, Katrina|Bazilian, Morgan",ENERGY POLICY,renewable energy policy|modelling|energy economics,10.1016/j.enpol.2006.01.025
110,WOS:000283094800003,2010,Uncertainty analysis for estimation of landfill emissions and data sensitivity for the input variation,,"Results of research and practical experience confirm that stabilization of GHG concentrations will require a tremendous effort. One of the sectors identified as a significant source of methane (CH()) emissions are solid waste disposal sites (SWDS). Landfills are the key source of CH() emissions in the emissions inventory of Slovakia, and the actual emission factors are estimated with a high uncertainty level. The calculation of emission uncertainty of the landfills using the more sophisticated Tier  Monte Carlo method is evaluated in this article. The software package that works with the probabilistic distributions and their combination was developed with this purpose in mind. The results, sensitivity analysis, and computational methodology of the CH() emissions from SWDS are presented in this paper.",,"Szemesova, J.|Gera, M.",CLIMATIC CHANGE,,10.1007/s10584-010-9919-1
111,WOS:000231782200001,2005,Scenario-based simulation of runoff-related pesticide entries into small streams on a landscape level,SURFACE|WATER|FIELD,"The prediction of runoff-related pesticide entry into surface waters on a landscape level usually requires considerable efforts with regard to input data, time, and personnel. Therefore, the need for an easy to use simulation tool with easily accessible input data, for example from already existing public sources, is obvious. In this paper, we present a simulation tool for the simulation of pesticide entry from arable land into adjacent streams. Our aim was to develop a tool applicable on the landscape level using ""real world data"" from numerous sites and for the simulation of parameter case studies concerning particular parameters at single sites. We used the ratio of exposure to toxicity (REXTOX) model proposed by the OECD, which had been successfully validated in the study area as part of a previous study and which was extended to calculate pesticide concentrations in adjacent streams. We simulated the pesticide entry on the landscape level at  sites in small streams situated in the central lowland of Germany with winter wheat, barley, and sugar beat as the main agricultural. crops. A sensitivity analysis indicated that the most significant model parameters were the width of the no-application zone and the degree of plant interception. The simulation was carried out for the  most frequently detected substances found in the study area using eight different environmental scenarios, covering variation of the width of the no-application zone, climate, and seasonal scenarios. The highest in-stream concentrations were predicted for a scenario using no ( m) buffer zone in conjunction with increased precipitation. According to the predicted concentrations, the risk for the aquatic communities was estimated based on standard toxicity tests and the application of a safety factor. The simulation results are presented both by means of risk maps for the study area showing the simulated pesticide concentration and the resulting ecological risk for numerous sites under varying scenarios and by case study diagrams with focus on the model behavior under the influence of single parameters. Risk maps confirmed the importance of no-application (buffer) zones for the levels of pesticide input. They also indicated the importance of the existing no-application zones for certain compounds and in some cases the need for a further evaluation of these regulations. The simulation tool was implemented as a standard PC software combining the REXTOX model with a geographical information system and can be used on any current personal computer. All input data was taken from public sources of German authorities. With little effort the tool should be applicable for other areas with similar data quality.", (C) 2005 Elsevier Inc. All rights reserved.,"Probst, M|Berenzen, N|Lentzen-Godding, A|Schulz, R",ECOTOXICOLOGY AND ENVIRONMENTAL SAFETY,risk assessment|pesticides|runoff|buffer zones|simulation|modeling|landscape level|climate change|risk mitigation,10.1016/j.ecoenv.2005.04.012
112,WOS:000168416500008,2001,A computational methodology for shape optimization of structures in frictionless contact,SUPERCONVERGENT PATCH RECOVERY|SENSITIVITY ANALYSIS|FORMULATION|ALGORITHMS|SOLIDS,"This paper presents a computational methodology for shape optimization of structures in frictionless contact. which provides a basis for developing user-friendly and efficient shape optimization software. For evaluation it has been implemented as a subsystem of a general finite element software. The overall design and main principles of operation of this software are outlined. The parts connected to shape optimization are described in more detail. The key building blocks are: analytic sensitivity analysis, an adaptive finite element method, an accurate contact solver. and a sequential convex programing optimization algorithm. Results for three model application examples are presented, in which the contact pressure and the effective stress are optimized.", (C) 2001 Elsevier Science B.V. All rights reserved.,"Hilding, D|Torstenfelt, B|Klarbring, A",COMPUTER METHODS IN APPLIED MECHANICS AND ENGINEERING,shape optimization|frictionless contact|finite element method|sensitivity analysis|adaptive meshing,10.1016/S0045-7825(00)00310-8
113,WOS:000392285600091,2016,Identifying critical architectural components with spectral analysis of fault trees,SOFTWARE ARCHITECTURE|RELIABILITY-ANALYSIS|SYSTEMS|MODELS|TOOLS,"We increasingly rely on software-intensive embedded systems. Increasing size and complexity of these hardware/software systems makes it necessary to evaluate reliability at the system architecture level. One aspect of this evaluation is sensitivity analysis, which aims at identifying critical components of the architecture. These are the components of which unreliability contributes the most to the unreliability of the system. In this paper, we propose a novel approach for sensitivity analysis based on spectral analysis of fault trees. We show that measures obtained with our approach are both consistent and complementary with respect to the recognized metrics in the literature.", (C) 2016 Elsevier B.V. All rights reserved.,"Ayav, Toga|Sozer, Hasan",APPLIED SOFT COMPUTING,hardware/software architecture evaluation|reliability analysis|fault trees|fourier analysis|sensitivity analysis|importance analysisa,10.1016/j.asoc.2016.06.042
114,WOS:000241177900002,2006,Design parameterization and tool integration for CAD-based mechanism optimization,,"This paper presents an open and integrated tool environment that enables engineers to effectively search, in a CAD solid model form, for a mechanism design with optimal kinematic and dynamic performance. In order to demonstrate the feasibility of such an environment, design parameterization that supports capturing design intents in product solid models must be available, and advanced modeling, simulation, and optimization technologies implemented in engineering software tools must be incorporated. In this paper, the design parameterization capabilities developed previously have been applied to support design optimization of engineering products, including a High Mobility Multi-purpose Wheeled Vehicle (HMMWV). In the proposed environment, Pro/ENGINEER and SolidWorks are supported for product model representation, DADS (Dynamic Analysis and Design System) is employed for dynamic simulation of mechanical systems including ground vehicles, and DOT (Design Optimization Tool) is included for a batch mode design optimization. In addition to the commercial tools, a number of software modules have been implemented to support the integration; e.g., interface modules for data retrieval, and model update modules for updating CAD and simulation models in accordance with design changes. Note that in this research, the overall finite difference method has been adopted to support design sensitivity analysis. (C) ", Elsevier Ltd. All rights reserved.,"Chang, Kuang-Hua|Joo, Sung-Hwan",ADVANCES IN ENGINEERING SOFTWARE,design optimization|design parameterization|computer-aided design|dynamic simulation|tool integration,10.1016/j.advengsoft.2006.05.005
115,WOS:000223572800017,2004,Radionuclide migration modeling through the soil-plant system as adapted for Hungarian environment,FOOD-CHAIN MODEL|DYNAMIC-MODEL|FALLOUT,"The migration of radionuclides released as fallout through the food-chain to humans was modelled using the MODELMAKER software. In the established dynamic environmental transfer model ETM- with compartmental structure, the principal pathways of vegetable contamination were studied specifically for the Hungarian environment. These pathways were: direct deposition on plant surface, root uptake and deposition after resuspension from the soil surface. As result of the modeling the variation of activity-concentration with time was obtained in the compartments. The validation of the model was done by comparing the calculated results with those obtained in field experiments. A sensitivity analysis of the input parameters was also carried out and the parameters were categorized by their sensitivity index (SI). According to this study, the most sensitive parameters are the daily human intake of vegetable, the distribution coefficient, the transfer factor from soil to plant and the weathering half-time. The most probable distribution types for the parameter values were also determined based on Monte Carlo simulations.", (C) 2004 Elsevier B.V. All rights reserved.,"Kabai, E|Zagyvai, P|Lang-Lazi, M|Oncsik, MB",SCIENCE OF THE TOTAL ENVIRONMENT,environmental model|plants|sensitivity analysis|sensitivity index,10.1016/j.scitotenv.2004.03.039
116,WOS:000227298500003,2005,Numerical approaches to life cycle interpretation - The case of the ecoinvent'96 database,,"Goal, Scope and Background. To strengthen the evaluative power of LCA, life cycle interpretation should be further developed. A previous contribution '(Heijungs & Kleijn ) elaborated five examples of concrete methods within the subset of numerical approaches towards interpretation. These methods were: contribution analysis, perturbation analysis, uncertainty analysis, comparative analysis, and discernibility analysis. Developments in software have enabled the possibility to apply the five example methods to explore the much-used ecoinvent ' database. Discussion of Methods. The numerical approaches implemented in this study include contribution analysis, perturbation analysis, uncertainty analysis, comparative analysis, discernibility analysis and the newly developed key issue analysis. The data used comes from a very large process database: ecoinvent ', containing  processes,  economic flows and  environmental flows. Conclusions. Results are twofold: they serve as a benchmark to the usefulness and feasibility of these numerical approaches, and they shed light on the question of stability and structure in an often-used large system of interconnected processes. Most of the approaches perform quite well: computation time on a moderate PC is between a few seconds and a few minutes. Only Monte Carlo analyses may require much longer, but even then it appears that most questions can be answered within a few hours. Moreover, analytical expressions for error propagation are much faster than Monte Carlo analyses, while providing almost identical results. Despite the fact that many processes are connected to each other, leading to the possibility of a very unstable system and very sensitive coefficients, the overall results show that most results are not extremely uncertain. There are, however, some exceptions to this positive message.",,"Heijungs, R|Suh, S|Kleijn, R",INTERNATIONAL JOURNAL OF LIFE CYCLE ASSESSMENT,contribution analysis|discernibility analysis|ecoinvent'96|key issue analysis|life cycle interpretation|perturbation analysis|sensitivity analysis|uncertainty analysis,10.1065/lca2004.06.161
117,WOS:000400267300014,2017,Hierarchical approach to hydrological model calibration,WATER-QUALITY MODELS|UNCERTAINTY ANALYSIS|RIVER-BASIN|SWAT|OPTIMIZATION|FLOW|EQUIFINALITY|PREDICTIONS|SENSITIVITY|VALIDATION,"Hydrological models have been widely used for water resources management. Successful application of hydrological models depends on careful calibration and uncertainty analysis. Spatial unit of water balance calculations may differ widely in different models from grids to hydrological response units (HRU). The Soil and Water Assessment Tool (SWAT) software uses HRU as the spatial unit. SWAT simulates hydrological processes at sub-basin level by deriving HRUs by thresholding areas of soil type, land use, and slope combinations. This may ignore some important areas, which may have great impact on hydrological processes in the watershed. In this study, a hierarchical HRU approach was developed in order to increase model performance and reduce computational complexity simultaneously. For hierarchical optimization, HRUs are first divided into two-HRU types and are optimized with respect to some relevant influence parameters. Then, each HRU is further divided into two. Each child HRU inherits the optimum parameter values of the parent HRU as its initial value. This approach decreases the total calibration time while obtaining a better result. The performance of the hierarchical methodology is demonstrated on two basins, namely Sarisu-Eylikler and Namazgah Dam Lake Basins in Turkey. In Sarisu-Eylikler, we obtained good results by a combination of curve number (CN), soil hydraulic conductivity, and slope for generating HRUs, while in Namazgah use of only CN gave better results.",,"Ozdemir, Ayfer|Leloglu, Ugur Murat|Abbaspour, Karim C.",ENVIRONMENTAL EARTH SCIENCES,swat|calibration|hydrological response unit|sufi2|optimization,10.1007/s12665-017-6560-6
118,WOS:000413245200004,2017,A user-friendly software package for VIC hydrologic model development,GLOBAL SENSITIVITY-ANALYSIS|PRECIPITATION PRODUCTS|MULTISITE CALIBRATION|SOIL-MOISTURE|RUNOFF-MODEL|WATER|BASIN|SIMULATION|DATASET|FLUXES,"The Variable Infiltration Capacity (VIC) hydrologic and river routing model simulates the water and energy fluxes that occur near the land surface and provides useful information regarding the quantity and timing of available water within a watershed system. However, despite its popularity, wider adoption is hampered by the considerable effort required to prepare model inputs and calibrate the model parameters. This study presents a user-friendly software package, named VIC-Automated Setup Toolkit (VIC-ASSIST), accessible through an intuitive MATLAB graphical user interface. VIC-ASSIST enables users to navigate the model building process through prompts and automation, with the intention to promote the use of the model for practical, educational, and research purposes. The automated processes include watershed delineation, climate and geographical input set-up, model parameter calibration, sensitivity analysis, and graphical output generation. We demonstrate the package's utilities in various case studies. (C) ", Elsevier Ltd. All rights reserved.,"Wi, Sungwook|Ray, Patrick|Demaria, Eleonora M. C.|Steinschneider, Scott|Brown, Casey",ENVIRONMENTAL MODELLING & SOFTWARE,vic hydrologic model|vic setup assistant tool|matlab graphic user interface|automatic calibration|sensitivity analysis,10.1016/j.envsoft.2017.09.006
119,WOS:000353715400015,2015,LCI Databases Sensitivity Analysis of the Environmental Impact of the Injection Molding Process,LIFE-CYCLE ASSESSMENT,"During the last decades, society's concern for the environment has increased. Specific tools like the Life Cycle Assessment (LCA), and software and databases to apply this method have been developed to calculate the environmental burden of products or processes. Calculating the environmental impact of plastic products is relevant as the global plastics production rose to  million tons in . Among the different ways of processing plastics, the injection molding process is one of the most used in the industry worldwide. In this paper, a sensitivity analysis of the environmental impact of the injection molding process has been carried out. In order to perform this study, the EcoInvent database inventory for injection molding, and the data from which this database is created, have been studied. Generally, when an LCA of a product is carried out, databases such as EcoInvent, where materials, processes and transports are characterized providing average values, are used to quantify the environmental impact. This approach can be good enough in some cases but in order to assess a specific production process, like injection molding, a further level of detail is needed. This study shows how the final results of environmental impact differ for injection molding when using the PVC's, PP's or PET's data. This aspect suggests the necessity of studying, in a more precise way, this process, to correctly evaluate its environmental burden. This also allows us to identify priority areas and thereby actions to develop a more sustainable way of manufacturing plastics.",,"Elduque, Ana|Javierre, Carlos|Elduque, Daniel|Fernandez, Angel",SUSTAINABILITY,,10.3390/su7043792
120,WOS:000388155500003,2016,GTApprox: Surrogate modeling for industrial design,SENSITIVITY-ANALYSIS|GAUSSIAN-PROCESSES|REGRESSION|REGULARIZATION|ALGORITHM|SELECTION|MACHINE|SPLINES|SAMPLES|EXPERTS,"We describe GTApprox - a new tool for medium-scale surrogate modeling in industrial design. Compared to existing software, GTApprox brings several innovations: a few novel approximation algorithms, several advanced methods of automated model selection, novel options in the form of hints. We demonstrate the efficiency of GTApprox on a large collection of test problems. In addition, we describe several applications of GTApprox to real engineering problems. (C) ", Elsevier Ltd. All rights reserved.,"Belyaev, Mikhail|Burnaev, Evgeny|Kapushev, Ermek|Panov, Maxim|Prikhodko, Pavel|Vetrov, Dmitry|Yarotsky, Dmitry",ADVANCES IN ENGINEERING SOFTWARE,approximation|surrogate model|surrogate-based optimization,10.1016/j.advengsoft.2016.09.001
