,id,year,title,keywords,abstract,copyright,AU,SO,DE,DOI
220,WOS:000256840200114,2007,Estimating uncertainty on internal dose assessments,RADON PROGENY|UNIT EXPOSURE|DOSIMETRY,"The estimation of uncertainty on doses broadly falls into three categories. () Estimating the uncertainty on prospective doses. Here, the intake is known and the uncertainties in individual parameter values must be propagated through the calculated dose. () Estimating the error or uncertainty on dose assessments made from single measurements. Here, intake, model parameter and measurement uncertainties are propagated into the measurement, but default ICRP parameter values are used to estimate the intake and dose from the measurement. ()Estimating the probability distribution of an individual's dose from a set of monitoring data. Here, Bayesian inference methods must be used to estimate the uncertainty on the estimated dose. A computer code is being developed that performs all three types of uncertainty analysis using Monte Carlo simulation. The software samples biokinetic parameters from probability density functions and then calculates doses from these parameters by calling the dosimetry code IMBA Professional Plus. A description of the methodology, together with an example application of the software, is included in this paper.",,"Puncher, M.|Birchall, A.",RADIATION PROTECTION DOSIMETRY,,10.1093/rpd/ncm361
221,WOS:000349077200002,2015,Second law and sensitivity analysis of large ME-TVC desalination units,MULTIPLE-EFFECT EVAPORATION|THERMAL-ANALYSIS|EXERGY ANALYSIS|SYSTEMS|PERFORMANCE|ENERGY,"Large number of low temperature multi-effect thermal vapor compression (ME-TVC) desalination units have been installed recently in most of the GCC countries. The new trend of combining ME-TVC with conventional multi-effect led to tremendous increase in the unit size more than eight times during a very short period. The unit size capacity of this technology is currently available with  million imperial gallons per day (MIGD), and research studies are expected to increase this unit capacity up to  MIGD in the near future. Hence, this technology becomes highly attractive and competitive against multi stage flash desalination system. A mathematical model of ME-TVC desalination system is developed in this paper, using Engineering Equation Solver Software. This model is used to evaluate and improve the system performance of some new commercial ME-TVC units with capacities of ., ., and . MIGD using energy and exergy analysis. A sensitivity analysis is also presented in this paper to investigate the system performance of Al-Jubail ME-TVC unit in KSA, which is considered as the largest ME-TVC desalination plant in the world. Results showed that the first effect was found to be responsible for about % of the total effects exergy destruction in Al-Jubail, compared to % in ALBA and % in Umm Al-Nar. Results also showed that the specific exergy destruction is reduced significantly by increasing the number of effects as well as working at lower top brine temperatures.",,"Binamer, Anwar",DESALINATION AND WATER TREATMENT,thermal vapor|multi-effect|exergy|desalination,10.1080/19443994.2013.852481
222,WOS:000377792100014,2016,"Application of run-off model as a contribution to the torrential flood risk management in Topiderska Reka watershed, Serbia",CATCHMENTS,"This paper deals with developing of hydrological flow model for the torrential watershed of the Topiderska River, located in the Belgrade macro-region, in which torrential flood events have had destructive human and material consequences. The aim of the paper was to show that model, developed by hydrological software SHETRAN, is useful tool enabling the simulation of physical properties and hydrological processes in watersheds, having a significant place in decision support system within the torrential flood risk management. Results achievement was enabled through three phases: () Sensitivity analysis showed that the closest hydrograph to registered hydrograph is modelled with averaged values of parameters; () model calibration was done by calibration of four main parameters with significant influence on flow component (hydraulic conductivity of soil and rock, Strickler roughness coefficient for overland and river network flow) in case of the torrential flood event from th July ; and () model verification was done by input of calibrated values in case of two another torrential flood events (, ). Statistical analysis of correspondence of modelled and registered discharges showed that due to correlation coefficient (.-.) and determination coefficient (.-.) as well as probability of error according to F test, good results are achieved. Considering obtained results, developed model should be a part of torrential flood risk management in watershed of Topiderska River.",,"Petrovic, Ana M.|Kovacevic-Majkic, Jelena|Milosevic, Marko V.",NATURAL HAZARDS,hydrological model|run-off|discharge|torrential flood|topciderska river,10.1007/s11069-016-2269-1
223,WOS:000302910100010,2012,Robust design in aerodynamics using third-order sensitivity analysis based on discrete adjoint. Application to quasi-1D flows,SHAPE OPTIMIZATION|DATA ASSIMILATION|1ST,"In this paper, the second-order second moment approach, coupled with an adjoint-based steepest descent algorithm, for the solution of the so-called robust design problem in aerodynamics is proposed. Because the objective function for the robust design problem comprises first-order and second-order sensitivity derivatives with respect to the environmental parameters, the application of a gradient-based method , which requires the sensitivities of this function with respect to the design variables, calls for the computation of third-order mixed derivatives. To compute these derivatives with the minimum CPU cost, a combination of the direct differentiation and the discrete adjoint variable method is proposed. This is presented for the first time in the relevant literature and is the most efficient among other possible schemes on condition that the design variables are much more than the environmental ones; this is definitely true in most engineering design problems. The proposed approach was used for the robust design of a duct, assuming a quasi-D flow model; the coordinates of the Bezier control points parameterizing the duct shape are used as design variables, whereas the outlet Mach number and the DarcyWeisbach friction coefficient are used as environmental ones. The extension to D and D flow problems, after developing the corresponding direct differentiation and adjoint variable methods and software, is straightforward."," Copyright (C) 2011 John Wiley & Sons, Ltd.","Papoutsis-Kiachagias, E. M.|Papadimitriou, D. I.|Giannakoglou, K. C.",INTERNATIONAL JOURNAL FOR NUMERICAL METHODS IN FLUIDS,robust aerodynamic shape optimization|discreteadjoint method|third-order sensitivity derivatives|method of moments,10.1002/fld.2604
224,WOS:000236011600030,2006,A standard interface between simulation programs and systems analysis software,TRANSPORT PARAMETERS|AQUATIC SYSTEMS|UNCERTAINTY|MODELS|MINIMIZATION|FLOW,"A simple interface between simulation programs and systems analytical software is proposed. This interface is designed to facilitate linkage of environmental simulation programs with systems analytical software and thus can contribute to remedying the deficiency in applying systems analytical techniques to environmental modelling studies. The proposed concept, consisting of a text file interface combined with a batch mode simulation program call, is independent of model structure, operating system and programming language. It is open for implementation by academic and commercial simulation and systems analytical software developers and is very simple to implement. Its practicability is demonstrated by implementations for three environmental simulation packages (AQUASIM, SWAT and LEACHM) and two systems analytical program packages (UNCSIM, SUR). The properties listed above and the demonstration of the ease of implementation of the approach are prerequisites for the stimulation of a widespread implementation of the proposed interface that would be beneficial for the dissemination of systems analytical techniques in the environmental and engineering sciences. Furthermore, such a development could stimulate the transfer of systems analytical techniques between different fields of application.",,"Reichert, P",WATER SCIENCE AND TECHNOLOGY,systems analytical techniques|environmental simulation programs|statistical inference|sensitivity analysis|identifiability analysis|uncertainty analysis,10.2166/wst.2006.029
225,WOS:000245389900003,2007,A non-intrusive stochastic Galerkin approach for modeling uncertainty propagation in deformation processes,PARTIAL-DIFFERENTIAL-EQUATIONS|CONTINUUM SENSITIVITY METHOD|METAL-FORMING PROCESS|POLYNOMIAL CHAOS|DESIGN,"Large deformation processes are inherently complex considering the non-linear phenomena that need to be accounted for. Stochastic analysis of these processes is a formidable task due to the numerous sources of uncertainty and the various random input parameters. As a result, uncertainty propagation using intrusive techniques requires tortuous analysis and overhaul of the internal structure of existing deterministic analysis codes. In this paper, we present an approach called non-intrusive stochastic Galerkin (NISG) method, which can be directly applied to presently available deterministic legacy software for modeling deformation processes with minimal effort for computing the complete probability distribution of the underlying stochastic processes. The method involves finite element discretization of the random support space and piecewise continuous interpolation of the probability distribution function over the support space with deterministic function evaluations at the element integration points. For the hyperelastic-viscoplastic large deformation problems considered here with varying levels of randomness in the input and boundary conditions, the NISG method provides highly accurate estimates of the statistical quantities of interest within a fraction of the time required using existing Monte Carlo methods. (c) ", Elsevier Ltd. All rights reserved.,"Acharjee, Swagato|Zabaras, Nicholas",COMPUTERS & STRUCTURES,uncertainty|deformation processes|stochastic galerkin methods|stochastic modeling,10.1016/j.compstruc.2006.10.004
226,WOS:000311245300006,2012,Combining explanatory crop models with geospatial data for regional analyses of crop yield using field-scale modeling units,CLIMATE-CHANGE SCENARIOS|SIMULATION-MODELS|PRECISION AGRICULTURE|SPATIAL-RESOLUTION|COMPUTER-PROGRAM|DECISION-SUPPORT|RICE PRODUCTION|WINTER-WHEAT|GIS|IMPACTS,"Crop models are used to predict yield and resource requirements as well as to evaluate different climate or management scenarios at a specific site. However, problems involving land use or global climate change encompass larger, more diverse, spatial scales and would benefit from simulating over broader areas using high-resolution, spatially-distributed data. A geospatial interface was developed to combine the explanatory potato crop model SPUDSIM with the geographic information system (GIS) software ArcGIS using the scripting language Python. Multiple geospatial input data layers were incorporated, including weather, soil, management, and land use. Modeling units (MUs) were defined as homogeneous field-scale areas created by the intersection of the input layers. Crop production was simulated for each unique combination of climate, soil, and management for MUs classified as cropland. The outputs (crop yield, water use, and nitrogen uptake) were mapped to show the spatial distribution within each county and aggregated to the county-level over the region of interest. An example was provided for potato production in Maine and illustrates how potential crop yield varies spatially over the state. The geospatial crop model showed evidence of both spatial and temporal variability of crop yield at the county level. The interface was designed to be flexible and easy to apply to applications such as evaluating crop production capacity and response under different scenarios.", Published by Elsevier B.V.,"Resop, Jonathan P.|Fleisher, David H.|Wang, Qingguo|Timlin, Dennis J.|Reddy, Vangimalla R.",COMPUTERS AND ELECTRONICS IN AGRICULTURE,crop modeling|geographic information systems|spatial aggregation|regional analysis|sensitivity analysis|land use change,10.1016/j.compag.2012.08.001
227,WOS:000252516900010,2008,Self-adjoint sensitivity analysis of lossy dielectric structures with electromagnetic time-domain simulators,MICROWAVE IMAGE-RECONSTRUCTION|OPTIMAL-DESIGN METHOD|GRIDS,"We present an efficient self-adjoint approach for the computation of response derivatives in lossy inhomogencous structures with time-domain electromagnetic solvers. Our approach yields the responses and their derivatives with only one system analysis regardless of the number of optimizable parameters. The only requirement is to access the field solution at the perturbation grid points. The computation is performed as an independent post-process outside the solver. This makes our approach easy to implement as stand-alone software, which aids microwave design based on commercial computer-aided design packages. We show that our sensitivity analysis approach yields Jacobians of second-order accuracy for lossy dielectric structures. The approach is verified through -D, -D and -D examples using the time-domain field solutions obtained with solvers based on the finite-difference time-domain (FDTD) and transmission line modeling (TLM) methods."," Copyright (c) 2007 John Wiley & Sons, Ltd.","Song, Yunpeng|Li, Ying|Nikolova, Natalia K.|Bakr, Mohamed H.",INTERNATIONAL JOURNAL OF NUMERICAL MODELLING-ELECTRONIC NETWORKS DEVICES AND FIELDS,time-domain analysis|sensitivity analysis|adjoint-variable methods|tlm method|fdtd method,10.1002/jnm.659
228,WOS:000246956100013,2007,Evaluation of urban stormwater quality models,,"The use of urban stormwater quality models necessitates the estimation of their outputs uncertainty level. The results of the application of a Monte Carlo Markov Chain method based on the Bayesian theory for the calibration and uncertainty analysis of a storm water quality model commonly used in available software are presented in this paper. The tested model estimates the accumulation, erosion and transport of pollutants on surfaces and in sewers using a hydrologic/hydrodynamic scheme. The model was calibrated for  different initial conditions of in-sewer deposits. Calibration results showed a large variability in the model outputs in function of the initial conditions and demonstrated that the tested model predictive capacity is very low.",,"Kanso, Assem|Tassin, Bruno|Chebbo, Ghassan",HOUILLE BLANCHE-REVUE INTERNATIONALE DE L EAU,,10.1051/lhb:2007025
229,WOS:000332292700001,2014,Multiobjective Combinatorial Auctions in Transportation Procurement,OF-THE-ART,"This paper presents a multiobjective winner determination combinatorial auction mechanism for transportation carriers to present multiple transport lanes and bundle the lanes as packet bids to the shippers for the purposes of ocean freight. This then allows the carriers to maximize their network of resources and pass some of the cost savings onto the shipper. Specifically, we formulate three multi-objective optimization models (weighted objective model, preemptive goal programming, and compromise programming) under three criteria of cost, marketplace fairness, and the marketplace confidence in determining the winning packages. We develop solutions on the three models and perform a sensitivity analysis to show the options the shipper can use depending on the existing conditions at the point of awarding the transport lanes.",,"Ignatius, Joshua|Hosseini-Motlagh, Seyyed-Mahdi|Goh, Mark|Sepehri, Mohammad Mehdi|Mustafa, Adli|Rahman, Amirah",MATHEMATICAL PROBLEMS IN ENGINEERING,,10.1155/2014/951783
230,WOS:000321690600011,2013,Data-driven sensitivity analysis to detect missing data mechanism with applications to structural equation modelling,GOODNESS-OF-FIT|IMPROPER SOLUTIONS|STANDARD ERRORS|VALUES,"Missing data are a common problem in almost all areas of empirical research. Ignoring the missing data mechanism, especially when data are missing not at random (MNAR), can result in biased and/or inefficient inference. Because MNAR mechanism is not verifiable based on the observed data, sensitivity analysis is often used to assess it. Current sensitivity analysis methods primarily assume a model for the response mechanism in conjunction with a measurement model and examine sensitivity to missing data mechanism via the parameters of the response model. Recently, Jamshidian and Mata (Post-modelling sensitivity analysis to detect the effect of missing data mechanism, Multivariate Behav. Res.  (), pp. -) introduced a new method of sensitivity analysis that does not require the difficult task of modelling the missing data mechanism. In this method, a single measurement model is fitted to all of the data and to a sub-sample of the data. Discrepancy in the parameter estimates obtained from the the two data sets is used as a measure of sensitivity to missing data mechanism. Jamshidian and Mata describe their method mainly in the context of detecting data that are missing completely at random (MCAR). They used a bootstrap type method, that relies on heuristic input from the researcher, to test for the discrepancy of the parameter estimates. Instead of using bootstrap, the current article obtains confidence interval for parameter differences on two samples based on an asymptotic approximation. Because it does not use bootstrap, the developed procedure avoids likely convergence problems with the bootstrap methods. It does not require heuristic input from the researcher and can be readily implemented in statistical software. The article also discusses methods of obtaining sub-samples that may be used to test missing at random in addition to MCAR. An application of the developed procedure to a real data set, from the first wave of an ongoing longitudinal study on aging, is presented. Simulation studies are performed as well, using two methods of missing data generation, which show promise for the proposed sensitivity method. One method of missing data generation is also new and interesting in its own right.",,"Jamshidian, Mortaza|Yuan, Ke-Hai",JOURNAL OF STATISTICAL COMPUTATION AND SIMULATION,factor analysis|generating missing data|incomplete data|missing at random|missing not at random|sensitivity analysis|simulation|sub-sample,10.1080/00949655.2012.660486
231,WOS:000249622700001,2007,An integrated framework for multipollutant air quality management and its application in georgia,SOUTHEASTERN UNITED-STATES|SOURCE APPORTIONMENT|TIME-SERIES|POLLUTION|OZONE|MODEL|EMISSIONS|MORTALITY|HEALTH|PM2.5,"Air protection agencies in the United States increasingly confront non-attainment of air quality standards for multiple pollutants sharing interrelated emission origins. Traditional approaches to attainment planning face important limitations that are magnified in the multipollutant context. Recognizing those limitations, the Georgia Environmental Protection Division has adopted an integrated framework to address ozone, fine particulate matter, and regional haze in the state. Rather than applying atmospheric modeling merely as a final check of an overall strategy, photochemical sensitivity analysis is conducted upfront to compare the effectiveness of controlling various precursor emission species and source regions. Emerging software enables the modeling of health benefits and associated economic valuations resulting from air pollution control. Photochemical sensitivity and health benefits analyses, applied together with traditional cost and feasibility assessments, provide a more comprehensive characterization of the implications of various control options. The fuller characterization both informs the selection of control options and facilitates the communication of impacts to affected stakeholders and the public. Although the integrated framework represents a clear improvement over previous attainment-planning efforts, key remaining shortcomings are also discussed.",,"Cohan, Daniel S.|Boylan, James W.|Marmur, Amit|Khan, Maudood N.",ENVIRONMENTAL MANAGEMENT,air pollution control|cost-benefit analysis|ozone|fine particulate matter|state implementation plans|attainment,10.1007/s00267-006-0228-4
232,WOS:000302212800003,2012,Effect of Temporal and Spatial Rainfall Resolution on HSPF Predictive Performance and Parameter Estimation,HYDROLOGICAL SIMULATION PROGRAM|AUTOMATIC CALIBRATION|MODEL PARAMETERS|VARIABILITY|RUNOFF|PRECIPITATION|RADAR|UNCERTAINTY|IMPACT|FLOW,"Watershed-scale rainfall-runoff models are used for environmental management and regulatory modeling applications, but their effectiveness is limited by predictive uncertainties associated with model input data. This study evaluated the effect of temporal and spatial rainfall resolution on the predictive performance of Hydrological Simulation Program-Fortran (HSPF) using manual and automatic calibration procedures. Furthermore, the effect of automatic parameter estimation on the physical significance of calibrated parameter values was evaluated. Temporal resolutions examined included  min,  min,  h, and  h, and spatial resolution effects evaluated included the effect of a spatially averaged network of four rain gauges and Next-Generation Radar (NEXRAD) for selected rain events. Model efficiencies ranged from . to . when individual rain gauges (RG, RG, RG, and RG) were used one at a time. Model efficiency improved and ranged from . to . when a spatially averaged network of four rain gauges was used. The effect of temporal resolution on model performance varied with rain gauge location in the watershed and with use of a single gauge or spatially averaged rain gauges for model calibration. Rainfall resolution has a strong influence on parameter estimation because, to achieve high model performance, parameter values must shift whenever the resolution of the rainfall data is changed. Despite a shift in parameter values as a result of changes in rainfall resolution, the results showed that Parameter Estimation Software (PEST)-calibrated values remained within their parameter bounds. In summary, results obtained from a medium-sized Piedmont watershed in Georgia, USA, revealed that model performance was more sensitive to spatial resolution than temporal resolution. DOI: ./(ASCE)HE.-..", (C) 2012 American Society of Civil Engineers.,"Mohamoud, Yusuf M.|Prieto, Lourdes M.",JOURNAL OF HYDROLOGIC ENGINEERING,hspf|spatial resolution|temporal resolution|parameter estimation|model performance|watershed modeling,10.1061/(ASCE)HE.1943-5584.0000457
233,WOS:000300438500006,2012,GIS Water-Balance Approach to Support Surface Water Flood-Risk Management,RESOLUTION TOPOGRAPHIC DATA|DIGITAL ELEVATION MODELS|DISTRIBUTED MODEL|OVERLAND-FLOW|URBAN AREAS|INUNDATION|SIMULATION|DRAINAGE|RUNOFF|SYSTEM,"Controversy has arisen as to whether the lack of appropriate consideration to surface water flood risk in urban spatial planning is reducing the capacity to manage urban flood risk. A screening tool is required which would allow spatial planners to identify potential surface water flood risks and explore their management opportunities. An urban water balance approach is presented. The hypothesis is that key hydrological characteristics, storage volume and location, flow paths, and surface water generation, capture the key processes responsible for surface water flooding. The model is assembled and run by using ESRI ArcGIS software. Surface sinks and their catchment areas are identified by using a Lidar DEM. Excess surface water is calculated by using a runoff coefficient that is applied to rainfall volumes, and no other losses are considered. A surface water accumulation module sums the excess surface water from the catchment area of each sink. A sensitivity analysis of model assumptions demonstrates that these are valid for a screening tool. An informal validation of the model with local authority data revealed that most of the known flood risk locations were highlighted by the model. The model is applied to Keighley and sample results illustrate how knowledge of sink storage can be interpreted to explore opportunities for flood risk management. The model is a useful tool for quickly assessing potential flood risk locations and basic management options. DOI: ./(ASCE)HE.-..", (C) 2012 American Society of Civil Engineers.,"Diaz-Nieto, J.|Lerner, D. N.|Saul, A. J.|Blanksby, J.",JOURNAL OF HYDROLOGIC ENGINEERING,pluvial flooding|surface water|gis|water balance|flood risk|keighley|uk|lidar|urban drainage,10.1061/(ASCE)HE.1943-5584.0000416
