,AU,year,title,journal,citations,DOI link
0,"Landuyt, D|Broekx, S|D'hondt, R|Engelen, G|Aertsens, J|Goethals, PLM",2013,A review of Bayesian belief networks in ecosystem service modelling,ENVIRONMENTAL MODELLING & SOFTWARE,94,https://dx.doi.org/10.1016/j.envsoft.2013.03.011
1,"van Delden, H|Seppelt, R|White, R|Jakeman, AJ",2011,A methodology for the design and development of integrated models for policy support,ENVIRONMENTAL MODELLING & SOFTWARE,86,https://dx.doi.org/10.1016/j.envsoft.2010.03.021
2,"Chen, KP|Blong, R|Jacobson, C",2001,MCE-RISK: integrating multicriteria evaluation and CIS for risk decision-making in natural hazards,ENVIRONMENTAL MODELLING & SOFTWARE,79,https://dx.doi.org/10.1016/S1364-8152(01)00006-8
20,"Bertrand-Krajewski, JL",2007,Stormwater pollutant loads modelling: epistemological aspects and case studies on the influence of field data sets on calibration and verification,WATER SCIENCE AND TECHNOLOGY,58,https://dx.doi.org/10.2166/wst.2007.090
3,"Carnevale, C|Finzi, G|Pisoni, E|Volta, M|Guariso, G|Gianfreda, R|Maffeis, G|Thunis, P|White, L|Triacchini, G",2012,An integrated assessment tool to define effective air quality policies at regional scale,ENVIRONMENTAL MODELLING & SOFTWARE,45,https://dx.doi.org/10.1016/j.envsoft.2012.07.004
4,"Brown, HE|Huth, NI|Holzworth, DP|Teixeira, EI|Zyskowski, RF|Hargreaves, JNG|Moot, DJ",2014,Plant Modelling Framework: Software for building and running crop models on the APSIM platform,ENVIRONMENTAL MODELLING & SOFTWARE,28,https://dx.doi.org/10.1016/j.envsoft.2014.09.005
5,"Burger, G|Sitzenfrei, R|Kleidorfer, M|Rauch, W",2014,Parallel flow routing in SWMM 5,ENVIRONMENTAL MODELLING & SOFTWARE,27,https://dx.doi.org/10.1016/j.envsoft.2013.11.002
15,"Zobel, RW",2008,Hardware and software efficacy in assessment of fine root diameter distributions,COMPUTERS AND ELECTRONICS IN AGRICULTURE,21,https://dx.doi.org/10.1016/j.compag.2007.08.002
21,"Mair, M|Sitzenfrei, R|Kleidorfer, M|Moderl, M|Rauch, W",2012,GIS-based applications of sensitivity analysis for sewer models,WATER SCIENCE AND TECHNOLOGY,18,https://dx.doi.org/10.2166/wst.2012.954
16,"Resop, JP|Fleisher, DH|Wang, QG|Timlin, DJ|Reddy, VR",2012,Combining explanatory crop models with geospatial data for regional analyses of crop yield using field-scale modeling units,COMPUTERS AND ELECTRONICS IN AGRICULTURE,15,https://dx.doi.org/10.1016/j.compag.2012.08.001
17,"Landry, H|Lague, C|Roberge, M",2006,Discrete element representation of manure products,COMPUTERS AND ELECTRONICS IN AGRICULTURE,14,https://dx.doi.org/10.1016/j.compag.2005.10.004
6,"Goor, F|Jossart, JM|Ledent, JF",2000,ECOP: an economic model to assess the willow short rotation coppice global profitability in a case of small scale gasification pathway in Belgium,ENVIRONMENTAL MODELLING & SOFTWARE,12,https://dx.doi.org/10.1016/S1364-8152(00)00014-1
7,"Fragoso, CR|van Nes, EH|Janse, JH|Marques, DD",2009,IPH-TRIM3D-PCLake: A three-dimensional complex dynamic model for subtropical aquatic ecosystems,ENVIRONMENTAL MODELLING & SOFTWARE,11,https://dx.doi.org/10.1016/j.envsoft.2009.05.006
18,"Karmakar, S|NKetia, M|Lague, C|Agnew, J",2010,Development of expert system modeling based decision support system for swine manure management,COMPUTERS AND ELECTRONICS IN AGRICULTURE,11,https://dx.doi.org/10.1016/j.compag.2009.12.009
8,"Wieland, R|Gutzler, C",2014,Environmental impact assessment based on dynamic fuzzy simulation,ENVIRONMENTAL MODELLING & SOFTWARE,9,https://dx.doi.org/10.1016/j.envsoft.2014.02.001
9,"Parker, J|Kim, U|Kitanidis, P|Cardiff, M|Liu, XY|Beyke, G",2012,Stochastic cost optimization of DNAPL remediation - Method description and sensitivity study,ENVIRONMENTAL MODELLING & SOFTWARE,7,https://dx.doi.org/10.1016/j.envsoft.2012.05.002
10,"Meng, QX|Wang, W",2014,A Novel Closed-Form Solution for Circular Openings in Generalized Hoek-Brown Media,MATHEMATICAL PROBLEMS IN ENGINEERING,5,https://dx.doi.org/10.1155/2014/870835
22,"Nielsen, NH|Larsen, MRA|Rasmussen, SF",2011,Development of a screening method to assess flood risk on Danish national roads and highway systems,WATER SCIENCE AND TECHNOLOGY,4,https://dx.doi.org/10.2166/wst.2011.157
19,"Mussadiq, Z|Laszlo, B|Helyes, L|Gyuricza, C",2015,Evaluation and comparison of open source program solutions for automatic seed counting on digital images,COMPUTERS AND ELECTRONICS IN AGRICULTURE,3,https://dx.doi.org/10.1016/j.compag.2015.08.010
11,"Yu, VF|Normasari, NME|Luong, HT",2015,Integrated Location-Production-Distribution Planning in a Multiproducts Supply Chain Network Design Model,MATHEMATICAL PROBLEMS IN ENGINEERING,2,https://dx.doi.org/10.1155/2015/473172
12,"Dan, DH|Yang, T|Gong, JX",2014,Intelligent Platform for Model Updating in a Structural Health Monitoring System,MATHEMATICAL PROBLEMS IN ENGINEERING,1,https://dx.doi.org/10.1155/2014/628619
23,"Marsili-Libelli, S|D'Ardes, V|Bondi, C",2008,Development of a open-vessel single-stage respirometer,WATER SCIENCE AND TECHNOLOGY,1,https://dx.doi.org/10.2166/wst.2008.149
14,"Li, F|Yi, ZL",2016,A New Software Reliability Growth Model: Multigeneration Faults and a Power-Law Testing-Effort Function,MATHEMATICAL PROBLEMS IN ENGINEERING,0,https://dx.doi.org/10.1155/2016/9276093
13,"Feng, SQ",2017,Numerical Study of the Performance and Emission of a Diesel-Syngas Dual Fuel Engine,MATHEMATICAL PROBLEMS IN ENGINEERING,0,https://dx.doi.org/10.1155/2017/6825079
