AU,year,title,journal,citations,Avg. Citations,abstract,DOI,DOI link
"Yang, J | Reichert, P | Abbaspour, KC | Xia, J | Yang, H",2008,Comparing uncertainty analysis techniques for a SWAT application to the Chaohe Basin in China,Applications_JOURNAL OF HYDROLOGY,316,31.6,"Distributed watershed models are increasingly being used to support decisions about alternative management strategies in the areas of land use change, climate change, water allocation, and pollution control. For this reason it is important that these models pass through a careful calibration and uncertainty analysis. To fulfil this demand, in recent years, scientists have come up with various uncertainty analysis techniques for watershed models. To determine the differences and similarities of these techniques we compared five uncertainty analysis procedures: Generalized Likelihood Uncertainty Estimation (GLUE), Parameter Solution (ParaSol), Sequential Uncertainty Fitting algorithm (SUFI-), and a Bayesian framework implemented using Markov chain Monte Carlo (MCMC) and Importance Sampling (IS) techniques. As these techniques are different in their philosophies and leave the user some freedom in formulating the generalized likelihood measure, objective function, or likelihood function, a literal comparison between these techniques is not possible. As there is a small spectrum of different applications in hydrology for the first three techniques, we made this choice according to their typical, use in hydrology. For Bayesian inference, we used a recently developed likelihood function that does not obviously violate the statistical assumptions, namely a continuous-time autoregressive error model. We implemented all these techniques for the soil and water assessment toot (SWAT) and applied them to the Chaohe Basin in China. We compared the results with respect to the posterior parameter distributions, performances of their best estimates, prediction uncertainty, conceptual bases, computational efficiency, and difficulty of implementation. The comparison results for these categories are listed and the advantages and disadvantages are analyzed. From the point of view of the authors, if computationally feasible, Bayesian-based approaches are most recommendable because of their solid conceptual basis, but construction and test of the likelihood function requires critical attention.",10.1016/j.jhydrol.2008.05.012,https://dx.doi.org/10.1016/j.jhydrol.2008.05.012
"Pedersen, CBW | Buhl, T | Sigmund, O",2001,Topology synthesis of large-displacement compliant mechanisms,Applications_INTERNATIONAL JOURNAL FOR NUMERICAL METHODS IN ENGINEERING,237,13.94,"This paper describes the use of topology optimization as a synthesis tool for the design of large-displacement compliant mechanisms. An objective function for the synthesis of large-displacement mechanisms is proposed together with a formulation for synthesis of path-generating compliant mechanisms. The responses of the compliant mechanisms are modelled using a total Lagrangian finite element formulation, the sensitivity analysis is performed using the adjoint method and the optimization problem is solved using the method of moving asymptotes. Procedures to circumvent some numerical problems are discussed.",10.1002/nme.148,https://dx.doi.org/10.1002/nme.148
"Le Maitre, OP | Knio, OM | Najm, HN | Ghanem, RG",2004,Uncertainty propagation using Wiener-Haar expansions,Applications_JOURNAL OF COMPUTATIONAL PHYSICS,209,14.93,"An uncertainty quantification scheme is constructed based on generalized Polynomial Chaos (PC) representations. Two such representations are considered, based on the orthogonal projection of uncertain data and solution variables using either a Haar or a Legendre basis. Governing equations for the unknown coefficients in the resulting representations are derived using a Galerkin procedure and then integrated in order to determine the behavior of the stochastic process. The schemes are applied to a model problem involving a simplified dynamical system and to the classical problem of Rayleigh-Benard instability. For situations involving random parameters close to a critical point, the computational implementations show that the Wiener-Haar (WHa) representation provides more robust predictions that those based on a Wiener-Legendre (WLe) decomposition. However, when the solution depends smoothly on the random data, the WLe scheme exhibits superior convergence. Suggestions regarding future extensions are finally drawn based on these experiences.",10.1016/j.jcp.2003.11.033,https://dx.doi.org/10.1016/j.jcp.2003.11.033
"McVicar, TR | Van Niel, TG | Li, LT | Hutchinson, MF | Mu, XM | Liu, ZH",2007,Spatially distributing monthly reference evapotranspiration and pan evaporation considering topographic influences,Applications_JOURNAL OF HYDROLOGY,205,18.64,"Many hydrological models engage spatially distributed measures of 'potential evapotranspiration' (ETpot). The reliability and utility of the physically based Penman-Monteith approach to generate ETpot has been recently advocated. Assuming land-surface conditions, spatial surfaces of reference evapotranspiration (ETO) can be generated taking into account the topographic influence of forcing meteorological variables. This was performed in this paper by spatially interpolating maximum (T-max) and minimum (T-min) air temperatures, wind speed (u) and vapor pressure (ea), using a spline model with a linear sub-model dependency on elevation, and modelling the radiation environment, taking topography (i.e., elevation, slope and aspect) into account, prior to calculating ETO at each grid-cell. In accordance with previous research, resultant lapse rates showed a strong seasonal pattern; values were steeper in summer than winter and those for Tma, were steeper than for T-min. Monthly mean T-max lapse rates varied from -. degrees C km(-) in winter to -. degrees C km(-) in summer, with T-min lapse rates ranging from -. degrees C km(-) in winter, to -. degrees C km(-) in summer. Monthly climatotogies of the near-surface elevation-dependence (NSED) for u and ea also showed strong seasonal values. NSED of u varied from . ms(-) km(-) in winter reducing to . ms(-) km(-) in summer. The NSED for e(a) ranged from -. kPa km(-) in winter to -. kPa km(-) in summer. For a -month sequence from  through , spatial surfaces of ET with a  m resolution for the , km() study site located in the Loess Plateau, China were generated using an 'interpolate-then-catculate' approach. Resultant ET values varied from about  mm month(-) in winter to over  mm month(-) in summer. In order to assess the reliability of these ETO surfaces, pan evaporation (Ep,,,) was also spatially interpolated and from these a set of pan coefficient (K-pan - a unitless ratio defined as ET/E-pan) surfaces were calculated. Spatio-temporally averaged K-pan values for the study site varied from . in April to . in late summer. K-pan values were in agreement with another study using a Chinese  cm diameter micro-pan, and, as expected, were tower than other values documented using a Class A pan. The influence of topography, especially aspect, was seen on the resultant ETO and K-pan, but not E-pan, surfaces. Sensitivity analysis showed that results were particularly stable in the hydrologically active portion of the year extending from March to October, inclusive. This study demonstrated that high spatial resolution monthly surfaces of ETO can be spatially modelled while taking into account the influence of topography on the forcing variables.",10.1016/j.jhydrol.2007.02.018,https://dx.doi.org/10.1016/j.jhydrol.2007.02.018
"Pappenberger, F | Beven, K | Horritt, M | Blazkova, S",2005,Uncertainty in the calibration of effective roughness parameters in HEC-RAS using inundation and downstream level observations,Applications_JOURNAL OF HYDROLOGY,201,15.46,"An uncertainty analysis of the unsteady flow component (UNET) of the one-dimensional model HEC-RAS within the generalised likelihood uncertainty estimation (GLUE) is presented. For this, the model performance of runs with different sets of Manning roughness coefficients, chosen from a range between . and ., are compared to inundation data and an outflow hydrograph. The influence of variation in the weighting coefficient of the numerical scheme is also investigated. For the latter, the empirical results show no advantage of using values below  and suggest the use of a fully implicit scheme (weighting parameter equals ). The results of varying the reach scale roughnesses shows that many parameter sets can perform equally well (problem of equifinality) even with extreme values. However, this depends on the model region and boundary conditions. The necessity to distinguish between effective parameters and real physical parameters is emphasised. The study demonstrates that this analysis can be used to produce dynamic probability maps of flooding during an event and can be linked to a stopping criterion for GLUE.",10.1016/j.jhydrol.2004.06.036,https://dx.doi.org/10.1016/j.jhydrol.2004.06.036
"Gong, LB | Xu, CY | Chen, DL | Halldin, S | Chen, YQD",2006,Sensitivity of the Penman-Monteith reference evapotranspiration to key climatic variables in the Changjiang (Yangtze River) basin,Applications_JOURNAL OF HYDROLOGY,200,16.67,"Sensitivity analysis is important in understanding the relative importance of climatic variables to the variation of reference evapotranspiration (ETref). In this study, a non-dimensional relative sensitivity coefficient was employed to predict responses of ETref to perturbations of four climatic variables in the Changjiang (Yangtze River) basin. ETref was estimated with the FAO- Penman-Monteith equation. A -year historical dataset of daily air temperature, wind speed, relative humidity and daily sunshine duration at  national meteorological observatory stations was used in the analysis. Results show that the response of ETref can be precisely predicted under perturbation of relative humidity or shortwave radiation by their sensitivity coefficients; the predictive power under perturbations of air temperature and wind speed depended on the magnitude of the perturbation, season and region. The prediction errors were much smaller than the seasonal and regional variation of their sensitivity coefficients. The sensitivity coefficient could also be used to predict the response of ETref to co-perturbation of several variables. The accuracy of the prediction increases from the lower to the upper region. Spatial variations of long-term average monthly and yearly sensitivity coefficients were obtained by interpolation of station estimates. In general, relative humidity was the most sensitive variable, followed by shortwave radiation, air temperature and wind speed. The actual rank of the four climatic variables in terms of their sensitivity varied with season and region. The large spatial variability of the sensitivity coefficients of all the climatic variables in the middle and tower regions of the basin was to a large extent determined by the distinct wind-speed patterns in those two regions.",10.1016/j.jhydrol.2006.03.027,https://dx.doi.org/10.1016/j.jhydrol.2006.03.027
"Le Maitre, OP | Najm, HN | Ghanem, RG | Knio, OM",2004,Multi-resolution analysis of Wiener-type uncertainty propagation schemes,Applications_JOURNAL OF COMPUTATIONAL PHYSICS,181,12.93,"A multi-resolution analysis (MRA) is applied to an uncertainty propagation scheme based on a generalized polynomial chaos (PC) representation. The MRA relies on an orthogonal projection of uncertain data and solution variables onto a multi-wavelet basis, consisting of compact piecewise-smooth polynomial functions. The coefficients of the expansion are computed through a Galerkin procedure. The MRA scheme is applied to the simulation of the Lorenz system having a single random parameter. The convergence of the solution with respect to the resolution level and expansion order is investigated. In particular, results are compared to two Monte-Carlo sampling strategies, demonstrating the superiority of the MRA. For more complex problems, however, the MRA approach may require excessive CPU times. Adaptive methods are consequently developed in order to overcome this drawback. Two approaches are explored: the first is based on adaptive refinement of the multi-wavelet basis, while the second is based on adaptive block-partitioning of the space of random variables. Computational tests indicate that the latter approach is better suited for large problems, leading to a more efficient, flexible and parallelizable scheme.",10.1016/j.jcp.2003.12.020,https://dx.doi.org/10.1016/j.jcp.2003.12.020
"Oberkampf, WL | Barone, MF",2006,Measures of agreement between computation and experiment: Validation metrics,Applications_JOURNAL OF COMPUTATIONAL PHYSICS,176,14.67,"With the increasing role of computational modeling in engineering design, performance estimation, and safety assessment, improved methods are needed for comparing computational results and experimental measurements. Traditional methods of graphically comparing computational and experimental results, though valuable, are essentially qualitative. Computable measures are needed that can quantitatively compare computational and experimental results over a range of input, or control, variables to sharpen assessment of computational accuracy. This type of measure has been recently referred to as a validation metric. We discuss various features that we believe should be incorporated in a validation metric, as well as features that we believe should be excluded. We develop a new validation metric that is based on the statistical concept of confidence intervals. Using this fundamental concept, we construct two specific metrics: one that requires interpolation of experimental data and one that requires regression (curve fitting) of experimental data. We apply the metrics to three example problems: thermal decomposition of a polyurethane foam, a turbulent buoyant plume of helium, and compressibility effects on the growth rate of a turbulent free-shear layer. We discuss how the present metrics are easily interpretable for assessing computational model accuracy, as well as the impact of experimental measurement uncertainty on the accuracy assessment.",10.1016/j.jcp.2006.03.037,https://dx.doi.org/10.1016/j.jcp.2006.03.037
"Stegmann, J | Lund, E",2005,Discrete material optimization of general composite shell structures,Applications_INTERNATIONAL JOURNAL FOR NUMERICAL METHODS IN ENGINEERING,169,13.0,A novel method for doing material optimization of general composite laminate shell structures is presented and its capabilities are illustrated with three examples. The method is labelled Discrete Material Optimization (DMO) but uses gradient information combined with mathematical programming to solve a discrete optimization problem. The method can be used to solve the orientation problem of orthotropic materials and the material selection problem as well as problems involving both. The method relies on ideas from multiphase topology optimization to achieve a parametrization which is very general and reduces the risk of obtaining a local optimum solution for the tested configurations. The applicability of the DMO method is demonstrated for fibre angle optimization of a cantilever beam and combined fibre angle and material selection optimization of a four-point beam bending problem and a doubly curved laminated shell.,10.1002/nme.1259,https://dx.doi.org/10.1002/nme.1259
"Kharmanda, G | Olhoff, N | Mohamed, A | Lemaire, M",2004,Reliability-based topology optimization,Applications_STRUCTURAL AND MULTIDISCIPLINARY OPTIMIZATION,154,11.0,"The objective of this work is to integrate reliability analysis into topology optimization problems. The new model, in which we introduce reliability constraints into a deterministic topology optimization formulation, is called Reliability-Based Topology Optimization (RBTO). Several applications show the importance of this integration. The application of the RBTO model gives a different topology relative to deterministic topology optimization. We also find that the RBTO model yields structures that are more reliable than those produced by deterministic topology optimization (for the same weight).",10.1007/s00158-003-0322-7,https://dx.doi.org/10.1007/s00158-003-0322-7
"Gersborg-Hansen, A | Sigmund, O | Haber, RB",2005,Topology optimization of channel flow problems,Applications_STRUCTURAL AND MULTIDISCIPLINARY OPTIMIZATION,137,10.54,"This paper describes a topology design method for simple two-dimensional flow problems. We consider steady, incompressible laminar viscous flows at low-to-moderate Reynolds numbers. This makes the flow problem nonlinear and hence a nontrivial extension of the work of Borrvall and Petersson (). Further, the inclusion of inertia effects significantly alters the physics, enabling solutions of new classes of optimization problems, such as velocity-driven switches, that are not addressed by the earlier method. Specifically, we determine optimal layouts of channel flows that extremize a cost function which measures either some local aspect of the velocity field or a global quantity, such as the rate of energy dissipation. We use the finite element method to model the flow, and we solve the optimization problem with a gradient-based math-programming algorithm that is driven by analytical sensitivities. Our target application is optimal layout design of channels in fluid network systems. Using concepts borrowed from topology optimization of compliant mechanisms in solid mechanics, we introduce a method for the synthesis of fluidic components, such as switches, diodes, etc.",10.1007/s00158-004-0508-7,https://dx.doi.org/10.1007/s00158-004-0508-7
"Gersborg-Hansen, A | Bendsoe, MP | Sigmund, O",2006,Topology optimization of heat conduction problems using the finite volume method,Applications_STRUCTURAL AND MULTIDISCIPLINARY OPTIMIZATION,122,10.17,"This note addresses the use of the finite volume method (FVM) for topology optimization of a heat conduction problem. Issues pertaining to the proper choice of cost functions, sensitivity analysis, and example test problems are used to illustrate the effect of applying the FVM as an analysis tool for design optimization. This involves an application of the FVM to problems with nonhomogeneous material distributions, and the arithmetic and harmonic averages have here been used to provide a unique value for the conductivity at element boundaries. It is observed that when using the harmonic average, checkerboards do not form during the topology optimization process.",10.1007/s00158-005-0584-3,https://dx.doi.org/10.1007/s00158-005-0584-3
"Zhang, XS | Srinivasan, R | Bosch, D",2009,Calibration and uncertainty analysis of the SWAT model using Genetic Algorithms and Bayesian Model Averaging,Applications_JOURNAL OF HYDROLOGY,113,12.56,"In this paper, the Genetic Algorithms (GA) and Bayesian Model Averaging (BMA) were used to simultaneously conduct calibration and uncertainty analysis for the Soil and Water Assessment Tool (SWAT), In this combined method, several SWAT models with different structures are first selected; next GA is used to calibrate each model using observed streamflow data; finally, BMA is applied to combine the ensemble predictions and provide uncertainty interval estimation. This method was tested in two contrasting basins, the Little River Experimental Basin in Georgia, USA, and the Yellow River Headwater Basin in China. The results obtained in the two case studies show that this combined method can provide deterministic predictions better than or comparable to the best calibrated model using GA. The .% and % uncertainty intervals estimated by this method were analyzed. The differences between the percentage of coverage of observations and the corresponding expected coverage percentage are within % for both calibration and validation periods in these two test basins. This combined methodology provides a practical and flexible tool to attain reliable deterministic simulation and uncertainty analysis of SWAT.",10.1016/j.jhydrol.2009.06.023,https://dx.doi.org/10.1016/j.jhydrol.2009.06.023
"Oh, HJ | Kim, YS | Choi, JK | Park, E | Lee, S",2011,"GIS mapping of regional probabilistic groundwater potential in the area of Pohang City, Korea",Applications_JOURNAL OF HYDROLOGY,109,15.57,"This study analyzed the relationships between groundwater specific capacity (SPC) and its related hydrological factors to assess the sensitivity of each factor and map the regional groundwater potential for the area of Pohang City, Korea, using a geographic information system (GIS) and a probability model. All related factors including topography, geology, lineament, and soil data were collected and entered into a spatial database. SPC data were collected from well locations, and SPC values of >= . m()/d/m, corresponding to a yield of  m()/d, were input to a spatial database. SPC data were then randomly selected in a / ratio to train and validate the model. A frequency-ratio model and sensitivity analysis were used to determine the relationships between SPC and its related factors and the importance of SPC-related factors. Sensitivity analysis allows for comparison of the combined effects of all factors except for one. The validation of the groundwater potential map overlain by all factors showed .% accuracy. In the sensitivity analysis, the best accuracy was obtained by omitting ground elevation data (.%), and the worst accuracy resulted when soil texture was not included (.%). The results show that soil texture had the greatest effect on the groundwater potential and ground elevation had the least effect. Such information and the maps generated from it can be applied to groundwater management and groundwater resource exploration.",10.1016/j.jhydrol.2010.12.027,https://dx.doi.org/10.1016/j.jhydrol.2010.12.027
"Blasone, RS | Madsen, H | Rosbjerg, D",2008,Uncertainty assessment of integrated distributed hydrological models using GLUE with Markov chain Monte Carlo sampling,Applications_JOURNAL OF HYDROLOGY,108,10.8,"In recent years, there has been an increase in the application of distributed, physically-based and integrated hydrological models. Many questions regarding how to property calibrate and validate distributed models and assess the uncertainty of the estimated parameters and the spatially-distributed responses are, however, still quite unexplored. Especially for complex models, rigorous parameterization, reduction of the parameter space and use of efficient and effective algorithms are essential to facilitate the calibration process and make it more robust. Moreover, for these models multi-site validation must complement the usual time validation. In this study, we develop, through an application, a comprehensive framework for multi-criteria calibration and uncertainty assessment of distributed physically-based, integrated hydrological, models. A revised version of the generalized likelihood uncertainty estimation (GLUE) procedure based on Markov chain Monte Carlo sampling is applied in order to improve the performance of the methodology in estimating parameters and posterior output distributions. The description of the spatial variations of the hydrological. processes is accounted for by defining a measure of model performance that includes multiple criteria and spatially-distributed information. An initial sensitivity analysis is conducted on the model to avoid overparameterisation and to increase the robustness of the approach. It is demonstrated that the employed methodology increases the identifiability of the parameters and results in satisfactory multi-variable simulations and uncertainty estimates. However, the parameter uncertainty atone cannot explain the total uncertainty at all the sites, due to limitations in the distributed data included in the model. calibration. The study also indicates that property distributed information of discharge is particularly crucial in model calibration and validation.",10.1016/j.jhydrol.2007.12.026,https://dx.doi.org/10.1016/j.jhydrol.2007.12.026
"Gunawan, S | Azarm, S",2005,Multi-objective robust optimization using a sensitivity region concept,Applications_STRUCTURAL AND MULTIDISCIPLINARY OPTIMIZATION,104,8.0,"In multi-objective design optimization, it is quite desirable to obtain solutions that are ""multi-objectively"" optimum and insensitive to uncontrollable (noisy) parameter variations. We call such solutions robust Pareto solutions. In this paper we present a method to measure the multi-objective sensitivity of a design alternative, and an approach to use such a measure to obtain multi-objectively robust Pareto optimum solutions. Our sensitivity measure does not require a presumed probability distribution of uncontrollable parameters and does not utilize gradient information; therefore, it is applicable to multi-objective optimization problems that have non-differentiable and/or discontinuous objective functions, and also to problems with large parameter variations. As a demonstration, we apply our robust optimization method to an engineering example, the design of a vibrating platform. We show that the solutions obtained for this example are indeed robust.",10.1007/s00158-004-0450-8,https://dx.doi.org/10.1007/s00158-004-0450-8
