,AU,year,title,journal,citations,DOI link
20,"van Griensven, A|Meixner, T|Grunwald, S|Bishop, T|Diluzio, A|Srinivasan, R",2006,A global sensitivity analysis tool for the parameters of multi-variable catchment models,OAT Publications_JOURNAL OF HYDROLOGY,582,https://dx.doi.org/10.1016/j.jhydrol.2005.09.008
0,"Saltelli, A|Annoni, P",2010,How to avoid a perfunctory sensitivity analysis,OAT Publications_ENVIRONMENTAL MODELLING & SOFTWARE,378,https://dx.doi.org/10.1016/j.envsoft.2010.04.012
1,"Chen, Y|Yu, J|Khan, S",2010,Spatial sensitivity analysis of multi-criteria weights in GIS-based land suitability evaluation,OAT Publications_ENVIRONMENTAL MODELLING & SOFTWARE,179,https://dx.doi.org/10.1016/j.envsoft.2010.06.001
21,"Al-Raoush, RI|Willson, CS",2005,Extraction of physically realistic pore network properties from three-dimensional synchrotron X-ray microtomography images of unconsolidated porous media systems,OAT Publications_JOURNAL OF HYDROLOGY,152,https://dx.doi.org/10.1016/j.jhydrol.2004.05.005
22,"Arabi, M|Govindaraju, RS|Hantush, MM",2007,A probabilistic approach for analysis of uncertainty in the evaluation of watershed management practices,OAT Publications_JOURNAL OF HYDROLOGY,115,https://dx.doi.org/10.1016/j.jhydrol.2006.09.012
2,"Gan, YJ|Duan, QY|Gong, W|Tong, C|Sun, YW|Chu, W|Ye, AZ|Miao, CY|Di, ZH",2014,A comprehensive evaluation of various sensitivity analysis methods: A case study with a hydrological model,OAT Publications_ENVIRONMENTAL MODELLING & SOFTWARE,82,https://dx.doi.org/10.1016/j.envsoft.2013.09.031
3,"Cheng, V|Steerners, K",2011,Modelling domestic energy consumption at district scale: A tool to support national and local energy policies,OAT Publications_ENVIRONMENTAL MODELLING & SOFTWARE,77,https://dx.doi.org/10.1016/j.envsoft.2011.04.005
23,"Haddad, K|Rahman, A",2012,Regional flood frequency analysis in eastern Australia: Bayesian GLS regression-based methods within fixed region and ROI framework - Quantile Regression vs. Parameter Regression Technique,OAT Publications_JOURNAL OF HYDROLOGY,67,https://dx.doi.org/10.1016/j.jhydrol.2012.02.012
30,"Ng, CA|Hungerbuhler, K",2013,Bioconcentration of Perfluorinated Alkyl Acids: How Important Is Specific Binding?,OAT Publications_ENVIRONMENTAL SCIENCE & TECHNOLOGY,53,https://dx.doi.org/10.1021/es400981a
4,"Chen, Y|Yu, J|Khan, S",2013,The spatial framework for weight sensitivity analysis in AHP-based multi-criteria decision making,OAT Publications_ENVIRONMENTAL MODELLING & SOFTWARE,53,https://dx.doi.org/10.1016/j.envsoft.2013.06.010
5,"Sun, XY|Newham, LTH|Croke, BFW|Norton, JP",2012,Three complementary methods for sensitivity analysis of a water quality model,OAT Publications_ENVIRONMENTAL MODELLING & SOFTWARE,49,https://dx.doi.org/10.1016/j.envsoft.2012.04.010
10,"Pappa, VA|Rees, RM|Walker, RL|Baddeley, JA|Watson, CA",2011,Nitrous oxide emissions and nitrate leaching in an arable rotation resulting from the presence of an intercrop,OAT Publications_AGRICULTURE ECOSYSTEMS & ENVIRONMENT,43,https://dx.doi.org/10.1016/j.agee.2011.02.025
31,"Ping, QY|Zhang, CY|Chen, XE|Zhang, B|Huang, ZY|He, Z",2014,Mathematical Model of Dynamic Behavior of Microbial Desalination Cells for Simultaneous Wastewater Treatment and Water Desalination,OAT Publications_ENVIRONMENTAL SCIENCE & TECHNOLOGY,41,https://dx.doi.org/10.1021/es504089x
32,"Shaviv, A|Raban, S|Zaidel, E",2003,Modeling controlled nutrient release from a population of polymer coated fertilizers: Statistically based model for diffusion release,OAT Publications_ENVIRONMENTAL SCIENCE & TECHNOLOGY,40,https://dx.doi.org/10.1021/es0205277
24,"Frey, MP|Schneider, MK|Dietzel, A|Reichert, P|Stamm, C",2009,Predicting critical source areas for diffuse herbicide losses to surface waters: Role of connectivity and boundary conditions,OAT Publications_JOURNAL OF HYDROLOGY,39,https://dx.doi.org/10.1016/j.jhydrol.2008.11.015
11,"Cayuela, ML|Aguilera, E|Sanz-Cobena, A|Adams, DC|Abalos, D|Barton, L|Ryals, R|Silver, WL|Alfaro, MA|Pappa, VA|Smith, P|Garnier, J|Billen, G|Bouwman, L|Bondeau, A|Lassaletta, L",2017,Direct nitrous oxide emissions in Mediterranean climate cropping systems: Emission factors based on a meta-analysis of available measurement data,OAT Publications_AGRICULTURE ECOSYSTEMS & ENVIRONMENT,38,https://dx.doi.org/10.1016/j.agee.2016.10.006
12,"Jarecki, MK|Parkin, TB|Chan, ASK|Kaspar, TC|Moorman, TB|Singer, JW|Kerr, BJ|Hatfield, JL|Jones, R",2009,Cover crop effects on nitrous oxide emission from a manure-treated Mollisol,OAT Publications_AGRICULTURE ECOSYSTEMS & ENVIRONMENT,37,https://dx.doi.org/10.1016/j.agee.2009.05.008
13,"Ceballos-Silva, A|Lopez-Blanco, J",2003,Evaluating biophysical variables to identify suitable areas for oat in Central Mexico: a multi-criteria and GIS approach,OAT Publications_AGRICULTURE ECOSYSTEMS & ENVIRONMENT,37,https://dx.doi.org/10.1016/S0167-8809(02)00180-9
33,"Howard, CJ|Kumar, A|Malkina, I|Mitloehner, F|Green, PG|Flocchini, RG|Kleeman, MJ",2010,Reactive Organic Gas Emissions from Livestock Feed Contribute Significantly to Ozone Production in Central California,OAT Publications_ENVIRONMENTAL SCIENCE & TECHNOLOGY,36,https://dx.doi.org/10.1021/es902864u
14,"Tan, CS|Drury, CF|Reynolds, WD|Groenevelt, PH|Dadfar, H",2002,Water and nitrate loss through tiles under a clay loam soil in Ontario after 42 years of consistent fertilization and crop rotation,OAT Publications_AGRICULTURE ECOSYSTEMS & ENVIRONMENT,36,https://dx.doi.org/10.1016/S0167-8809(01)00359-0
25,"Dhillon, KS|Dhillon, SK",2003,Quality of underground water and its contribution towards selenium enrichment of the soil-plant system for a seleniferous region of northwest India,OAT Publications_JOURNAL OF HYDROLOGY,35,https://dx.doi.org/10.1016/S0022-1694(02)00259-7
6,"Pastres, R|Ciavatta, S",2005,A comparison between the uncertainties in model parameters and in forcing functions: its application to a 3D water-quality model,OAT Publications_ENVIRONMENTAL MODELLING & SOFTWARE,35,https://dx.doi.org/10.1016/j.envsoft.2004.09.010
15,"Aslam, T|Choudhary, MA|Saggar, S",2000,Influence of land-use management on CO2 emissions from a silt loam soil in New Zealand,OAT Publications_AGRICULTURE ECOSYSTEMS & ENVIRONMENT,33,https://dx.doi.org/10.1016/S0167-8809(99)00102-4
7,"Hirabayashi, S|Kroll, CN|Nowak, DJ",2011,Component-based development and sensitivity analyses of an air pollutant dry deposition model,OAT Publications_ENVIRONMENTAL MODELLING & SOFTWARE,32,https://dx.doi.org/10.1016/j.envsoft.2010.11.007
16,"Alliaume, F|Rossing, WAH|Tittonell, P|Jorge, G|Dogliotti, S",2014,Reduced tillage and cover crops improve water capture and reduce erosion of fine textured soils in raised bed tomato systems,OAT Publications_AGRICULTURE ECOSYSTEMS & ENVIRONMENT,31,https://dx.doi.org/10.1016/j.agee.2013.11.001
8,"Brown, HE|Huth, NI|Holzworth, DP|Teixeira, EI|Zyskowski, RF|Hargreaves, JNG|Moot, DJ",2014,Plant Modelling Framework: Software for building and running crop models on the APSIM platform,OAT Publications_ENVIRONMENTAL MODELLING & SOFTWARE,29,https://dx.doi.org/10.1016/j.envsoft.2014.09.005
17,"Main, AR|Michel, NL|Cavallaro, MC|Headley, JV|Peru, KM|Morrissey, CA",2016,Snowmelt transport of neonicotinoid insecticides to Canadian Prairie wetlands,OAT Publications_AGRICULTURE ECOSYSTEMS & ENVIRONMENT,27,https://dx.doi.org/10.1016/j.agee.2015.09.011
18,"Assmann, JM|Anghinoni, I|Martins, AP|Costa, SEVGD|Cecagno, D|Carlos, FS|Caryalho, PCD",2014,Soil carbon and nitrogen stocks and fractions in a long-term integrated crop-livestock system under no-tillage in southern Brazil,OAT Publications_AGRICULTURE ECOSYSTEMS & ENVIRONMENT,25,https://dx.doi.org/10.1016/j.agee.2013.12.003
26,"Elsawwaf, M|Willems, P|Feyen, J",2010,"Assessment of the sensitivity and prediction uncertainty of evaporation models applied to Nasser Lake, Egypt",OAT Publications_JOURNAL OF HYDROLOGY,25,https://dx.doi.org/10.1016/j.jhydrol.2010.10.002
19,"Balota, EL|Calegari, A|Nakatani, AS|Coyne, MS",2014,Benefits of winter cover crops and no-tillage for microbial parameters in a Brazilian Oxisol: A long-term study,OAT Publications_AGRICULTURE ECOSYSTEMS & ENVIRONMENT,24,https://dx.doi.org/10.1016/j.agee.2014.07.010
34,"Moermond, CTA|Traas, TP|Roessink, I|Veltman, K|Hendriks, AJ|Koelmans, AA",2007,Modeling decreased food chain accumulation of PAHs due to strong sorption to carhonaceous materials and metabolic transformation,OAT Publications_ENVIRONMENTAL SCIENCE & TECHNOLOGY,22,https://dx.doi.org/10.1021/es0702364
9,"Schouten, M|Verwaart, T|Heijman, W",2014,Comparing two sensitivity analysis approaches for two scenarios with a spatially explicit rural agent-based model,OAT Publications_ENVIRONMENTAL MODELLING & SOFTWARE,18,https://dx.doi.org/10.1016/j.envsoft.2014.01.003
35,"Fellows, RJ|Wang, ZM|Ainsworth, CC",2003,Europium uptake and partitioning in oat (Avena sativa) roots as studied by laser-induced fluorescence spectroscopy and confocal microscopy profiling technique,OAT Publications_ENVIRONMENTAL SCIENCE & TECHNOLOGY,11,https://dx.doi.org/10.1021/es0343609
27,"Esmaeili, S|Thomson, NR|Tolson, BA|Zebarth, BJ|Kuchta, SH|Neilsen, D",2014,Quantitative global sensitivity analysis of the RZWQM to warrant a robust and effective calibration,OAT Publications_JOURNAL OF HYDROLOGY,9,https://dx.doi.org/10.1016/j.jhydrol.2014.01.051
36,"Atashgahi, S|Lu, Y|Ramiro-Garcia, J|Peng, P|Maphosa, F|Sipkema, D|Dejonghe, W|Smidt, H|Springael, D",2017,Geochemical Parameters and Reductive Dechlorination Determine Aerobic Cometabolic vs Aerobic Metabolic Vinyl Chloride Biodegradation at Oxic/Anoxic Interface of Hyporheic Zones,OAT Publications_ENVIRONMENTAL SCIENCE & TECHNOLOGY,8,https://dx.doi.org/10.1021/acs.est.6b05041
37,"Wang, M|Ford, RM",2010,Quantitative Analysis of Transverse Bacterial Migration Induced by Chemotaxis in a Packed Column with Structured Physical Heterogeneity,OAT Publications_ENVIRONMENTAL SCIENCE & TECHNOLOGY,7,https://dx.doi.org/10.1021/es902496v
28,"Zhang, Y|Irsa, J|Jiao, JY",2014,Three-dimensional aquifer inversion under unknown boundary conditions,OAT Publications_JOURNAL OF HYDROLOGY,6,https://dx.doi.org/10.1016/j.jhydrol.2013.11.024
29,"Ki, SJ|Ray, C",2015,A GIS-assisted regional screening tool to evaluate the leaching potential of volatile and non-volatile pesticides,OAT Publications_JOURNAL OF HYDROLOGY,5,https://dx.doi.org/10.1016/j.jhydrol.2014.12.024
38,"Sales-Ortells, H|Medema, G",2012,Screening-Level Risk Assessment of Coxiella burnetii (Q Fever) Transmission via Aeration of Drinking Water,OAT Publications_ENVIRONMENTAL SCIENCE & TECHNOLOGY,5,https://dx.doi.org/10.1021/es203744g
39,"Liu, JY|Han, MW|Wu, DM|Chen, X|Choe, JK|Werth, CJ|Strathmann, TJ",2016,A New Bioinspired Perchlorate Reduction Catalyst with Significantly Enhanced Stability via Rational Tuning of Rhenium Coordination Chemistry and Heterogeneous Reaction Pathway,OAT Publications_ENVIRONMENTAL SCIENCE & TECHNOLOGY,4,https://dx.doi.org/10.1021/acs.est.6b00886
