AU,year,title,journal,citations,Avg. Citations,abstract,DOI,DOI link
"Li, M | Hamel, J | Azarm, S",2010,Optimal uncertainty reduction for multi-disciplinary multi-output systems using sensitivity analysis,Applications_STRUCTURAL AND MULTIDISCIPLINARY OPTIMIZATION,12,1.5,"We present a sensitivity analysis based uncertainty reduction approach, called Multi-dIsciplinary Multi-Output Sensitivity Analysis (MIMOSA), for the analysis model of a multi-disciplinary engineering system decomposed into multiple subsystems with each subsystem analysis having multiple inputs with reducible uncertainty and multiple outputs. MIMOSA can determine: () the sensitivity of system and subsystem outputs to input uncertainties at both system and subsystem levels, () the sensitivity of the system outputs to the variation from subsystem outputs, and () the optimal ""investment"" required to reduce uncertainty in inputs in order to obtain a maximum reduction in output variations at both the system and subsystem levels. A numerical and an engineering example with two and three subsystems, respectively, have been used to demonstrate the applicability of the MIMOSA approach.",10.1007/s00158-009-0372-6,https://dx.doi.org/10.1007/s00158-009-0372-6
"Chen, G | Zhao, GZ | Chen, BAS",2009,Sensitivity analysis of coupled structural-acoustic systems subjected to stochastic excitation,Applications_STRUCTURAL AND MULTIDISCIPLINARY OPTIMIZATION,12,1.33,"A development for computing the acoustic pressure spectral density and its sensitivity of coupled structural-acoustic systems subjected to stochastic excitation is presented. Previous work in the area of structural-acoustic response considered systems subject to deterministic excitations. The response computation depends on the excitation; therefore, new methods are developed to account for stochastic excitation. The structural-acoustic response is calculated using finite element methods and stochastic analysis techniques. An accurate and highly efficient algorithm series for structural stationary random response analysis, pseudo excitation method (PEM) is used. Numerical examples are given to demonstrate the effectiveness of the methods and the program.",10.1007/s00158-008-0320-x,https://dx.doi.org/10.1007/s00158-008-0320-x
"Lu, D | Ye, M | Curtis, GP",2015,Maximum likelihood Bayesian model averaging and its predictive analysis for groundwater reactive transport models,Applications_JOURNAL OF HYDROLOGY,12,4.0,"While Bayesian model averaging (BMA) has been widely used in groundwater modeling, it is infrequently applied to groundwater reactive transport modeling because of multiple sources of uncertainty in the coupled hydrogeochemical processes and because of the long execution time of each model run. To resolve these problems, this study analyzed different levels of uncertainty in a hierarchical way, and used the maximum likelihood version of BMA, i.e., MLBMA, to improve the computational efficiency. This study demonstrates the applicability of MLBMA to groundwater reactive transport modeling in a synthetic case in which twenty-seven reactive transport models were designed to predict the reactive transport of hexavalent uranium (U(VI)) based on observations at a former uranium mill site near Naturita, CO. These reactive transport models contain three uncertain model components, i.e., parameterization of hydraulic conductivity, configuration of model boundary, and surface complexation reactions that simulate U(VI) adsorption. These uncertain model components were aggregated into the alternative models by integrating a hierarchical structure into MLBMA. The modeling results of the individual models and MLBMA were analyzed to investigate their predictive performance. The predictive logscore results show that MLBMA generally outperforms the best model, suggesting that using MLBMA is a sound strategy to achieve more robust model predictions relative to a single model. MLBMA works best when the alternative models are structurally distinct and have diverse model predictions. When correlation in model structure exists, two strategies were used to improve predictive performance by retaining structurally distinct models or assigning smaller prior model probabilities to correlated models. Since the synthetic models were designed using data from the Naturita site, the results of this study are expected to provide guidance for real-world modeling. Limitations of applying MLBMA to the synthetic study and future real-world modeling are discussed.",10.1016/j.jhydrol.2015.07.029,https://dx.doi.org/10.1016/j.jhydrol.2015.07.029
"Goderniaux, P | Brouyere, S | Wildemeersch, S | Therrien, R | Dassargues, A",2015,Uncertainty of climate change impact on groundwater reserves - Application to a chalk aquifer,Applications_JOURNAL OF HYDROLOGY,12,4.0,"Recent studies have evaluated the impact of climate change on groundwater resources for different geographical and climatic contexts. However, most studies have either not estimated the uncertainty around projected impacts or have limited the analysis to the uncertainty related to climate models. In this study, the uncertainties around impact projections from several sources (climate models, natural variability of the weather, hydrological model calibration) are calculated and compared for the Geer catchment ( km()) in Belgium. We use a surface-subsurface integrated model implemented using the finite element code HydroGeoSphere, coupled with climate change scenarios (-) and the UCODE_ inverse model, to assess the uncertainty related to the calibration of the hydrological model. This integrated model provides a more realistic representation of the water exchanges between surface and subsurface domains and constrains more the calibration with the use of both surface and subsurface observed data. Sensitivity and uncertainty analyses were performed on predictions. The linear uncertainty analysis is approximate for this nonlinear system, but it provides some measure of uncertainty for computationally demanding models. Results show that, for the Geer catchment, the most important uncertainty is related to calibration of the hydrological model. The total uncertainty associated with the prediction of groundwater levels remains large. By the end of the century, however, the uncertainty becomes smaller than the predicted decline in groundwater levels.",10.1016/j.jhydrol.2015.06.018,https://dx.doi.org/10.1016/j.jhydrol.2015.06.018
"Wen, Z | Liu, K | Chen, XL",2013,Approximate analytical solution for non-Darcian flow toward a partially penetrating well in a confined aquifer,Applications_JOURNAL OF HYDROLOGY,12,2.4,"In this study, non-Darcian flow to a partially penetrating well in a confined aquifer was investigated. The flow in the horizontal direction was assumed to be non-Darcian, while the flow in the vertical direction was assumed to be Darcian. The Izbash equation was employed to describe the non-Darcian flow in the horizontal direction of the aquifer. We used a linearization procedure to approximate the non-linear term in the governing equation enabling the mathematical model to be solved using a combination of Laplace and Fourier cosine transforms. Approximate analytical solutions for the drawdown were obtained and the impacts of different parameters on the drawdown were analyzed. The results indicated that a larger power index n in the Izbash equation leads to a larger drawdown at early times, while a larger n results in a smaller drawdown at late times. The drawdowns along the vertical direction z are symmetric if the well screen is located in the center of the aquifer, and the drawdown at the center of the aquifer is the largest along the vertical direction for this case. The length of the well screen w has little impact on the drawdown at early times, while a larger length of the well screen results in a smaller drawdown at late times. The drawdown increases with K-r at early times, while it decreases as K-r increases at late times, in which K-r is the apparent radial hydraulic conductivity. A sensitivity analysis of the parameters, i.e., the specific storage S-s, w, n and K-r, indicated that the drawdown is not sensitive to them at early times, while it is very sensitive to these parameters at late times especially to the power index n.",10.1016/j.jhydrol.2013.06.027,https://dx.doi.org/10.1016/j.jhydrol.2013.06.027
"Shi, XN | Zhang, F | Lei, TW | Chuo, RY | Zhou, SM | Yan, Y",2012,Measuring shallow water flow velocity with virtual boundary condition signal in the electrolyte tracer method,Applications_JOURNAL OF HYDROLOGY,12,2.0,"Accurate measurement of hill-slope shallow water flow velocity is an important issue in soil erosion prediction. The pulse model of electrolyte tracer advanced by Lei et al. () indicated that the boundary condition is critical for accurate velocity measurement. To improve the measurement accuracy, Lei et al. () improved the method by employing practically measured boundary condition instead of the pulse assumption, by an additional sensor close to the electrolyte injection location. The measurement precision was improved significantly as compared with that by the pulse model. However, the measured boundary condition is not the actual boundary condition, which may still cause errors in the measured velocities. The sensor for boundary measurement can otherwise be used to measure flow velocity if it can be rationally determined without measurement. In this study, modifications are made to the previous methods. The boundary condition is not measured by an additional sensor but is determined by fitting the model to the experimental data so as to determine virtual/real boundary condition (Virtual B.C.) at its actual position and the flow velocity simultaneously. The measured velocities and the estimated boundary condition are verified using the experimentally measured data involved three flow rates (,  and  L min(-)), three slope gradients ( degrees,  degrees and  degrees) and six measurement positions (., ., ., ., ., and . m). The newly-proposed Virtual B.C. method improved the measurement precision of velocities as compared with those by the previous methods. An additional experimental data set is used for sensitivity analysis. This experiment involves three flow rates (,  and  L min(-)), three slope gradients ( degrees,  degrees and  degrees), four measurement positions (., ., ., and . m), and three electrolyte injection durations (., ., and . s). The sensitivity analysis on measured velocity indicates that the Virtual B.C. method shows significant advantage of stability, regardless of electrolyte injection duration. The improvement is relatively more significant for shorter distance measurement and shorter electrolyte injection duration. The results are very encouraging to claim that the improved method is sound for short distance measurement and for portable instrument development.",10.1016/j.jhydrol.2012.05.046,https://dx.doi.org/10.1016/j.jhydrol.2012.05.046
"Jog, CS",2004,"Higher-order shell elements based on a Cosserat model, and their use in the topology design of structures",Applications_COMPUTER METHODS IN APPLIED MECHANICS AND ENGINEERING,12,0.86,"For the purpose of carrying out topology optimization of shell structures, we show that it is advantageous to use shell elements based on a classical shell theory (such as the Cosserat theory) rather than elements based on the degenerated solid approach, since the shell thickness appears explicitly in the formulation, thereby greatly simplifying the sensitivity analysis. One of the well-known shell elements based on the Cosserat shell theory is the four-node element presented by Simo et al. [Comput. Methods Appl. Mech. Engrg.  ()   () ]. Although one could use this element, the use of lower-order elements often results in instabilities (Such as the ""checkerboard"" instability) in the resulting topologies; this provides the motivation for developing higher-order shell elements based on a classical shell theory. In this work, we present the formulation and implementation details for six-node and seven-node triangular, and nine-node quadrilateral shell elements, which are based on the variational formulation of Simo et al., and show that good accuracy is obtained even with coarse meshes in fairly demanding problems. We also present the topology optimization formulation, and some examples of optimal topologies that are obtained using this formulation.",10.1016/j.cma.2004.01.011,https://dx.doi.org/10.1016/j.cma.2004.01.011
"Poette, G | Lucor, D",2012,Non intrusive iterative stochastic spectral representation with application to compressible gas dynamics,Applications_JOURNAL OF COMPUTATIONAL PHYSICS,12,2.0,"In this paper, we propose a new iterative formulation improving the convergence of standard non intrusive stochastic spectral method for uncertainty quantification. We demonstrate that the method is more accurate than the classical approach with the same level of approximation and at no significant additional computational or memory cost, since it is deployed in a post-processing stage. Moreover, the accuracy of the representation improves no matter the regularity of the random quantity of interest. Therefore, the method is particularly well suited when nonlinear transformations of random variables are in play and can be viewed as a new way of tackling the Gibbs phenomenon. We apply the method to several test cases with different levels of regularity, dimensionality and complexity, including the case of compressible gas dynamics and long time-integration problems. The new and the classical approaches are compared for the resolution of a stochastic Riemann problem governed by an Euler system.",10.1016/j.jcp.2011.12.038,https://dx.doi.org/10.1016/j.jcp.2011.12.038
"Shao, Q | Younes, A | Fahs, M | Mara, TA",2017,Bayesian sparse polynomial chaos expansion for global sensitivity analysis,Applications_COMPUTER METHODS IN APPLIED MECHANICS AND ENGINEERING,12,12.0,"Polynomial chaos expansions are frequently used by engineers and modellers for uncertainty and sensitivity analyses of computer models. They allow representing the input/output relations of computer models. Usually only a few terms are really relevant in such a representation. It is a challenge to infer the best sparse polynomial chaos expansion of a given model input/output data set. In the present article, sparse polynomial chaos expansions are investigated for global sensitivity analysis of computer model responses. A new Bayesian approach is proposed to perform this task, based on the Kashyap information criterion for model selection. The efficiency of the proposed algorithm is assessed on several benchmarks before applying the algorithm to identify the most relevant inputs of a double-diffusive convection model.",10.1016/j.cma.2017.01.033,https://dx.doi.org/10.1016/j.cma.2017.01.033
"Chakraborty, S | Chowdhury, R",2017,Towards 'h-p adaptive' generalized ANOVA,Applications_COMPUTER METHODS IN APPLIED MECHANICS AND ENGINEERING,12,12.0,"This paper presents a novel 'h-p adaptive' generalized analysis of variance decomposition (G-ANOVA) for high dimensional stochastic computations. Firstly, an iterative scheme based on variance based global sensitivity analysis is proposed to determine the optimal polynomial order and important component functions (p adaptivity) of G-ANOVA. Then, a homotopy algorithm is employed to determine the unknown expansion coefficients. Moreover, a novel distribution adaptive sequential experimental design (h-adaptivity) is utilized at each step and the accuracy of the G-ANOVA based surrogate model is computed using leave one out statistical test. It is observed that significantly less number of component functions are retained. As a consequence, the proposed approach is highly efficient and is applicable for solving problems involving large number of stochastic dimensions. Implementation of the proposed approach has been illustrated with four high dimensional applied mechanics problems. The proposed approach is found to yield accurate and efficient results. Finally, the proposed approach has been applied for structural reliability analysis of a large scale real life problem.",10.1016/j.cma.2017.03.028,https://dx.doi.org/10.1016/j.cma.2017.03.028
"Elsheikh, AH | Wheeler, MF | Hoteit, I",2014,Hybrid nested sampling algorithm for Bayesian model selection applied to inverse subsurface flow problems,Applications_JOURNAL OF COMPUTATIONAL PHYSICS,12,3.0,"A Hybrid Nested Sampling (HNS) algorithm is proposed for efficient Bayesian model calibration and prior model selection. The proposed algorithm combines, Nested Sampling (NS) algorithm, Hybrid Monte Carlo (HMC) sampling and gradient estimation using Stochastic Ensemble Method (SEM). NS is an efficient sampling algorithm that can be used for Bayesian calibration and estimating the Bayesian evidence for prior model selection. Nested sampling has the advantage of computational feasibility. Within the nested sampling algorithm, a constrained sampling step is performed. For this step, we utilize HMC to reduce the correlation between successive sampled states. HMC relies on the gradient of the logarithm of the posterior distribution, which we estimate using a stochastic ensemble method based on an ensemble of directional derivatives. SEM only requires forward model runs and the simulator is then used as a black box and no adjoint code is needed. The developed HNS algorithm is successfully applied for Bayesian calibration and prior model selection of several nonlinear subsurface flow problems.",10.1016/j.jcp.2013.10.001,https://dx.doi.org/10.1016/j.jcp.2013.10.001
"Chen, SS | Hansen, JM | Tortorelli, DA",2000,Unconditionally energy stable implicit time integration: application to multibody system analysis and design,Applications_INTERNATIONAL JOURNAL FOR NUMERICAL METHODS IN ENGINEERING,12,0.67,"This paper focuses on the development of an unconditionally stable time-integration algorithm for multibody dynamics that does not artificially dissipate energy. Unconditional stability is sought to alleviate any stability restrictions on the integration step size, while energy conservation is important for the accuracy of long-term simulations. In multibody system analysis, the time-integration scheme is complemented by a choice of coordinates that define the kinematics of the system. As such, the current approach uses a non-dissipative implicit Newmark method to integrate the equations of motion defined in terms of the independent joint co-ordinates of the system. In order to extend the unconditional stability of the implicit Newmark method to non-linear dynamic systems, a discrete energy balance is enforced. This constraint, however, yields spurious oscillations in the computed accelerations and therefore, a new acceleration corrector is developed to eliminate these instabilities and hence retain unconditional stability in an energy sense. An additional benefit of employing the non-linearly implicit time-integration method is that it allows for an efficient design sensitivity analysis. In this paper, design sensitivities computed via the direct differentiation method are used for mechanism performance optimization.",10.1002/(SICI)1097-0207(20000630)48:6<791::AID-NME859>3.0.CO;2-Z,https://dx.doi.org/10.1002/(SICI)1097-0207(20000630)48:6<791::AID-NME859>3.0.CO;2-Z
"Chen, P | Schwa, C",2016,"Sparse-grid, reduced-basis Bayesian inversion: Nonaffine-parametric nonlinear equations",Applications_JOURNAL OF COMPUTATIONAL PHYSICS,12,6.0,"We extend the reduced basis (RB) accelerated Bayesian inversion methods for affine-parametric, linear operator equations which are considered in [,] to non-affine, nonlinear parametric operator equations. We generalize the analysis of sparsity of parametric forward solution maps in [] and of Bayesian inversion in [,] to the fully discrete setting, including Petrov-Galerkin high-fidelity (""HiFi"") discretization of the forward maps. We develop adaptive, stochastic collocation based reduction methods for the efficient computation of reduced bases on the parametric solution manifold. The nonaffinity and nonlinearity with respect to (w.r.t.) the distributed, uncertain parameters and the unknown solution is collocated; specifically, by the so-called Empirical Interpolation Method (EIM). For the corresponding Bayesian inversion problems, computational efficiency is enhanced in two ways: first, expectations w.r.t. the posterior are computed by adaptive quadratures with dimension-independent convergence rates proposed in []; the present work generalizes [] to account for the impact of the PG discretization in the forward maps on the convergence rates of the Quantities of Interest (QoI for short). Second, we propose to perform the Bayesian estimation only w.r.t. a parsimonious, RB approximation of the posterior density. Based on the approximation results in [], the infinite-dimensional parametric, deterministic forward map and operator admit N-term RB and EIM approximations which converge at rates which depend only on the sparsity of the parametric forward map. In several numerical experiments, the proposed algorithms exhibit dimension-independent convergence rates which equal, at least, the currently known rate estimates for N-term approximation. We propose to accelerate Bayesian estimation by first offline construction of reduced basis surrogates of the Bayesian posterior density. The parsimonious surrogates can then be employed for online data assimilation and for Bayesian estimation. They also open a perspective for optimal experimental design.",10.1016/j.jcp.2016.02.055,https://dx.doi.org/10.1016/j.jcp.2016.02.055
"Elsheikh, AH | Wheeler, MF | Hoteit, I",2013,An iterative stochastic ensemble method for parameter estimation of subsurface flow models,Applications_JOURNAL OF COMPUTATIONAL PHYSICS,12,2.4,"Parameter estimation for subsurface flow models is an essential step for maximizing the value of numerical simulations for future prediction and the development of effective control strategies. We propose the iterative stochastic ensemble method (ISEM) as a general method for parameter estimation based on stochastic estimation of gradients using an ensemble of directional derivatives. ISEM eliminates the need for adjoint coding and deals with the numerical simulator as a blackbox. The proposed method employs directional derivatives within a Gauss-Newton iteration. The update equation in ISEM resembles the update step in ensemble Kalman filter, however the inverse of the output covariance matrix in ISEM is regularized using standard truncated singular value decomposition or Tikhonov regularization. We also investigate the performance of a set of shrinkage based covariance estimators within ISEM. The proposed method is successfully applied on several nonlinear parameter estimation problems for subsurface flow models. The efficiency of the proposed algorithm is demonstrated by the small size of utilized ensembles and in terms of error convergence rates.",10.1016/j.jcp.2013.01.047,https://dx.doi.org/10.1016/j.jcp.2013.01.047
"Sankaran, S | Grady, L | Taylor, CA",2015,Impact of geometric uncertainty on hemodynamic simulations using machine learning,Applications_COMPUTER METHODS IN APPLIED MECHANICS AND ENGINEERING,12,4.0,"In the cardiovascular system, blood flow rates, blood velocities and blood pressures can be modeled using the Navier-Stokes equations. Inputs to the system are typically uncertain, such as (a) the geometry of the arterial tree, (b) clinically measured blood pressure and viscosity, (c) boundary resistances, among others. Due to a large number of such parameters, efficient quantification of uncertainty in solution fields in this multi-parameter space is challenging. We use an adaptive stochastic collocation method to quantify the impact of uncertainty in geometry in patient-specific models. We develop a novel subdivision method to define the stochastic space of geometries. To accelerate convergence and make the problem tractable, we use a machine learning approach to approximate the simulation-based solution. Towards this, a reduced order model of the Navier-Stokes equations is developed using a segmental resistance analog boundary conditions (ratio of pressure to flow). Using an offline database of pre-computed solutions, we compute a map (rule) from the features to solution fields. We achieve significant speed-up (of a few orders of magnitude) by approximating the simulation-based solution using a machine learning predictor. A bootstrap aggregated decision tree was found to be the best predictor among many candidate regressors (correlation coefficient of training set was .). We demonstrate stochastic space convergence using the adaptive stochastic collocation method, and also show robustness to the choice of geometry parameterization. The sensitivities to geometry obtained using machine learning had a correlation coefficient of . with the values obtained using finite element simulations. Segments with significant disease in the larger arteries had the highest sensitivities. Terminal segments are more sensitive to dilation and proximal healthy segments are more sensitive to erosion. Sensitivity to geometry is highest when geometric resistance is comparable to net downstream resistance.",10.1016/j.cma.2015.08.014,https://dx.doi.org/10.1016/j.cma.2015.08.014
