AU,year,title,journal,citations,Avg. Citations,abstract,DOI,DOI link
"Liu, Y | Ren, LL | Hong, Y | Zhu, Y | Yang, XL | Yuan, F | Jiang, SH",2016,Sensitivity analysis of standardization procedures in drought indices to varied input data selections,Applications_JOURNAL OF HYDROLOGY,6,3.0,"Reasonable input data selection is of great significance for accurate computation of drought indices. In this study, a comprehensive comparison is conducted on the sensitivity of two commonly used standardization procedures (SP) in drought indices to datasets, namely the probability distribution based SP and the self-calibrating Palmer SP. The standardized Palmer drought index (SPDI) and the self-calibrating Palmer drought severity index (SC-PDSI) are selected as representatives of the two SPs, respectively. Using meteorological observations (-) in the Yellow River basin,  sub-datasets with a length of  years are firstly generated with the moving window method. Then we use the whole time series and  sub-datasets to compute two indices separately, and compare their spatiotemporal differences, as well as performances in capturing drought areas. Finally, a systematic investigation in term of changing climatic conditions and varied parameters in each SP is conducted. Results show that SPDI is less sensitive to data selection than SC-PDSI. SPDI series derived from different datasets are highly correlated, and consistent in drought area characterization. Sensitivity analysis shows that among the three parameters in the generalized extreme value (GEV) distribution, SPDI is most sensitive to changes in the scale parameter, followed by location and shape parameters. For SC-PDSI, its inconsistent behaviors among different datasets are primarily induced by the self-calibrated duration factors (p and q). In addition, it is found that the introduction of the self-calibrating procedure for duration factors further aggravates the dependence of drought index on input datasets compared with original empirical algorithm that Palmer uses, making SC-PDSI more sensitive to variations in data sample. This study clearly demonstrate the impacts of dataset selection on sensitivity of drought index computation, which has significant implications for proper usage of drought indices and related assessments, and potentially provide some valuable references for future researches on drought indices improvements.",10.1016/j.jhydrol.2016.04.073,https://dx.doi.org/10.1016/j.jhydrol.2016.04.073
"Lee, K | Ho, HC | Marian, M | Wu, CH",2014,Uncertainty in open channel discharge measurements acquired with StreamPro ADCP,Applications_JOURNAL OF HYDROLOGY,6,1.5,"The StreamPro Acoustic Doppler Current Profiler (ADCP) is a favorite solution for making discharge measurements of medium and small streams in practical situations. This paper investigates the implementation of a rigorous uncertainty analysis protocol to measurements conducted with StreamPro ADCP operated with the stationary method (a.k.a. section-by-section). The assessment of individual uncertainty components is based on the best available information and the results of customized experiments. The main contributions of this paper are: (a) estimating StreamPro ADCP discharge measurement uncertainty by a rigorous, standardized approach; and (b) the assessment of some uncertainty sources in the functional relationship of the discharge measurement process. Uncertainties were estimated through a practical end-to-end approach, whereby the effect of the targeted uncertainty was isolated and subsequently estimated based on direct measurements, rather than analytically deriving them via uncertainty propagation equations. The implementation example illustrates that the standardized uncertainty analysis framework can be successfully applied for hydrometric measurements. Elements and framework of the uncertainty analysis presented in this paper can be applied to other instruments that estimate stream discharge using a section-by-section method.",10.1016/j.jhydrol.2013.11.031,https://dx.doi.org/10.1016/j.jhydrol.2013.11.031
"Wang, S | Huang, GH | Baetz, BW | Ancell, BC",2017,Towards robust quantification and reduction of uncertainty in hydrologic predictions: Integration of particle Markov chain Monte Carlo and factorial polynomial chaos expansion,Applications_JOURNAL OF HYDROLOGY,6,6.0,"The particle filtering techniques have been receiving increasing attention from the hydrologic community due to its ability to properly estimate model parameters and states of nonlinear and non-Gaussian systems. To facilitate a robust quantification of uncertainty in hydrologic predictions, it is necessary to explicitly examine the forward propagation and evolution of parameter uncertainties and their interactions that affect the predictive performance. This paper presents a unified probabilistic framework that merges the strengths of particle Markov chain Monte Carlo (PMCMC) and factorial polynomial chaos expansion (FPCE) algorithms to robustly quantify and reduce uncertainties in hydrologic predictions. A Gaussian anamorphosis technique is used to establish a seamless bridge between the data assimilation using the PMCMC and the uncertainty propagation using the FPCE through a straightforward transformation of posterior distributions of model parameters. The unified probabilistic framework is applied to the Xiangxi River watershed of the Three Gorges Reservoir (TGR) region in China to demonstrate its validity and applicability. Results reveal that the degree of spatial variability of soil moisture capacity is the most identifiable model parameter with the fastest convergence through the streamflow assimilation process. The potential interaction between the spatial variability in soil moisture conditions and the maximum soil moisture capacity has the most significant effect on the performance of streamflow predictions. In addition, parameter sensitivities and interactions vary in magnitude and direction over time due to temporal and spatial dynamics of hydrologic processes.",10.1016/j.jhydrol.2017.03.027,https://dx.doi.org/10.1016/j.jhydrol.2017.03.027
"Najm, HN | Malorani, M",2014,Enforcing positivity in intrusive PC-UQ methods for reactive ODE systems,Applications_JOURNAL OF COMPUTATIONAL PHYSICS,6,1.5,"We explore the relation between the development of a non-negligible probability of negative states and the instability of numerical integration of the intrusive Galerkin ordinary differential equation system describing uncertain chemical ignition. To prevent this instability without resorting to either multi-element local polynomial chaos (PC) methods or increasing the order of the PC representation in time, we propose a procedure aimed at modifying the amplitude of the PC modes to bring the probability of negative state values below a user-defined threshold. This modification can be effectively described as a filtering procedure of the spectral PC coefficients, which is applied on-the-fly during the numerical integration when the current value of the probability of negative states exceeds the prescribed threshold. We demonstrate the filtering procedure using a simple model of an ignition process in a batch reactor. This is carried out by comparing different observables and error measures as obtained by non-intrusive Monte Carlo and Gauss-quadrature integration and the filtered intrusive procedure. The filtering procedure has been shown to effectively stabilize divergent intrusive solutions, and also to improve the accuracy of stable intrusive solutions which are close to the stability limits.",10.1016/j.jcp.2014.03.061,https://dx.doi.org/10.1016/j.jcp.2014.03.061
"Choi, M | Sapsis, TP | Karniadakis, GE",2014,On the equivalence of dynamically orthogonal and bi-orthogonal methods: Theory and numerical simulations,Applications_JOURNAL OF COMPUTATIONAL PHYSICS,6,1.5,"The Karhunen-Loeve (KL) decomposition provides a low-dimensional representation for random fields as it is optimal in the mean square sense. Although for many stochastic systems of practical interest, described by stochastic partial differential equations (SPDEs), solutions possess this low-dimensional character, they also have a strongly time-dependent form and to this end a fixed-in-time basis may not describe the solution in an efficient way. Motivated by this limitation of standard KL expansion, Sapsis and Lermusiaux () [] developed the dynamically orthogonal (DO) field equations which allow for the simultaneous evolution of both the spatial basis where uncertainty 'lives' but also the stochastic characteristics of uncertainty. Recently, Cheng et al. () [] introduced an alternative approach, the bi-orthogonal (BO) method, which performs the exact same tasks, i.e. it evolves the spatial basis and the stochastic characteristics of uncertainty. In the current work we examine the relation of the two approaches and we prove theoretically and illustrate numerically their equivalence, in the sense that one method is an exact reformulation of the other. We show this by deriving a linear and invertible transformation matrix described by a matrix differential equation that connects the BO and the DO solutions. We also examine a pathology of the BO equations that occurs when two eigenvalues of the solution cross, resulting in an instantaneous, infinite-speed, internal rotation of the computed spatial basis. We demonstrate that despite the instantaneous duration of the singularity this has important implications on the numerical performance of the BO approach. On the other hand, it is observed that the BO is more stable in nonlinear problems involving a relatively large number of modes. Several examples, linear and nonlinear, are presented to illustrate the DO and BO methods as well as their equivalence.",10.1016/j.jcp.2014.03.050,https://dx.doi.org/10.1016/j.jcp.2014.03.050
"Nordstrom, J | Wahlsten, M",2015,Variance reduction through robust design of boundary conditions for stochastic hyperbolic systems of equations,Applications_JOURNAL OF COMPUTATIONAL PHYSICS,6,2.0,"We consider a hyperbolic system with uncertainty in the boundary and initial data. Our aim is to show that different boundary conditions give different convergence rates of the variance of the solution. This means that we can with the same knowledge of data get a more or less accurate description of the uncertainty in the solution. A variety of boundary conditions are compared and both analytical and numerical estimates of the variance of the solution are presented. As an application, we study the effect of this technique on Maxwell's equations as well as on a subsonic outflow boundary for the Euler equations.",10.1016/j.jcp.2014.10.061,https://dx.doi.org/10.1016/j.jcp.2014.10.061
"Haji-Ali, AL | Nobile, F | Tamellini, L | Tempone, R",2016,Multi-Index Stochastic Collocation for random PDEs,Applications_COMPUTER METHODS IN APPLIED MECHANICS AND ENGINEERING,5,2.5,"In this work we introduce the Multi-Index Stochastic Collocation method (MISC) for computing statistics of the solution of a PDE with random data. MISC is a combination technique based on mixed differences of spatial approximations and quadratures over the space of random data. We propose an optimization procedure to select the most effective mixed differences to include in the MISC estimator: such optimization is a crucial step and allows us to build a method that, provided with sufficient solution regularity, is potentially more effective than other multi-level collocation methods already available in literature. We then provide a complexity analysis that assumes decay rates of product type for such mixed differences, showing that in the optimal case the convergence rate of MISC is only dictated by the convergence of the deterministic solver applied to a one dimensional problem. We show the effectiveness of MISC with some computational tests, comparing it with other related methods available in the literature, such as the Multi-Index and Multilevel Monte Carlo, Multilevel Stochastic Collocation, Quasi Optimal Stochastic Collocation and Sparse Composite Collocation methods.",10.1016/j.cma.2016.03.029,https://dx.doi.org/10.1016/j.cma.2016.03.029
"Li, DY | Peng, YH | Yin, JL",2007,Optimization of metal-forming process via a hybrid intelligent optimization technique,Applications_STRUCTURAL AND MULTIDISCIPLINARY OPTIMIZATION,5,0.45,"In recent years, finite element simulation has been increasingly combined with optimization techniques and applied to optimization of various metal-forming processes. The robustness and efficiency of process optimization are critical factors to obtain ideal results, especially for those complicated metal-forming processes. Gradient-based optimization algorithms are subject to mathematical restrictions of discontinuous searching space, while nongradient optimization algorithms often lead to excessive computation time. This paper presents a novel intelligent optimization approach that integrates machine learning and optimization techniques. An intelligent gradient-based optimization scheme and an intelligent response surface methodology are proposed, respectively. By machine learning based on the rough set algorithm, initial total design space can be reduced to self-continuous hypercubes as effective searching spaces. Then optimization algorithms can be implemented more effectively to find optimal design results. An extrusion forging process and a U channel roll forming process are studied as application samples and the effectiveness of the proposed approach is verified.",10.1007/s00158-006-0075-1,https://dx.doi.org/10.1007/s00158-006-0075-1
"Moshfegh, R | Nilsson, L | Larsson, M",2008,Estimation of process parameter variations in a pre-defined process window using a Latin hypercube method,Applications_STRUCTURAL AND MULTIDISCIPLINARY OPTIMIZATION,5,0.5,"The aim of this paper is to present a methodology that provides an analytical tool for estimation of robustness and response variation within a pre-defined process window. To exemplify the developed methodology, the stochastic simulation technique is used for a sheet-metal forming application. A sampling plan based on the Latin hypercube sampling method for variation of design parameters is utilized, and the thickness reduction is specified as the response. Moreover, the response surface methodology is applied for understanding the quantitative relationship between design parameters and response value. The conclusions of this study are that the applied method gives a possibility to illustrate and interpret the variation of the response versus a design parameter variation. Consequently, it gives significant insights into the usefulness of individual design parameters. It has been shown that the method enables us to estimate the admissible design parameter variations and to predict the actual safe margin for given process parameters. Furthermore, the dominating design parameters can be predicated using sensitivity analysis, and this in its turn clarifies how the reliability criteria are met. Finally, the developed software can be used as an additional module for set-up of stochastic finite element simulations and to collect the numerical results from different solvers within different applications.",10.1007/s00158-007-0136-0,https://dx.doi.org/10.1007/s00158-007-0136-0
"Liu, Y | Shi, Y | Zhou, Q | Xiu, RQ",2016,A sequential sampling strategy to improve the global fidelity of metamodels in multi-level system design,Applications_STRUCTURAL AND MULTIDISCIPLINARY OPTIMIZATION,5,2.5,"In engineering design, complex systems that involve a multitude of decision variables and parameters are often decomposed into several submodels (also called subsystems and/or components) with a hierarchical (multi-level) manner to manage complexity. Metamodeling techniques are widely used to replace the original time-consuming computer simulation models to further reduce computational burden in multi-level system performance analysis and design optimization. However, due to the limited samples from simulation models, metamodels may contain metamodeling uncertainties at un-sampled sites. Such metamodeling uncertainties arising from metamodels across the entire hierarchy will propagate from the lower to upper levels and eventually impact the top-level response of interest. With the aim of improving the global fidelity of metamodels for multi-level system performance analysis and design optimization, a new sequential sampling strategy is proposed in this paper. The proposed method contains two basic elements: () quantifying metamodeling uncertainty propagated from the lower-level metamodels to the top-level response of interest and () seeking a new sample site at which the global fidelity of the multi-level system model can be maximally improved. As exemplified by the two numerical examples and a multi-scale bracket structure example, with the same amount of samples from computer simulation models, the new sequential sampling strategy is superior to existing sequential sampling strategies in terms of improving the global fidelity of the metamodels of multi-level systems.",10.1007/s00158-015-1379-9,https://dx.doi.org/10.1007/s00158-015-1379-9
"Zhang, WH | Zhou, Y | Zhu, JH",2017,A comprehensive study of feature definitions with solids and voids for topology optimization,Applications_COMPUTER METHODS IN APPLIED MECHANICS AND ENGINEERING,5,5.0,"In this paper, we present a CAD-oriented and feature-driven topology optimization methodology for engineering structures with freeform design domains. Mixed solid-void features are adopted as basic design primitives to build a unified formulation of feature definition, while pure solid or pure void features are considered as two special cases. Topology optimization is achieved as a Boolean intersection process between the so-called topology variation modeler (TVM) and freeform design domain modeler (FDDM) in terms of level-set functions (LSFs). The TVMs constructed with solid and/or void features are applied to clip the FDDM through Boolean operations. It is shown that sensitivity analysis with boundary integral scheme is independent of the mathematical expressions of the LSF. Numerical problems with freeform and periodic design domains are dealt with to demonstrate the proposed topology optimization method.",10.1016/j.cma.2017.07.004,https://dx.doi.org/10.1016/j.cma.2017.07.004
"Le, TT | Guilleminot, J | Soize, C",2016,Stochastic continuum modeling of random interphases from atomistic simulations. Application to a polymer nanocomposite,Applications_COMPUTER METHODS IN APPLIED MECHANICS AND ENGINEERING,5,2.5,"This paper is concerned with the probabilistic multiscale analysis of polymeric materials reinforced by nanoscopic fillers. More precisely, this work is devoted to the stochastic modeling and inverse identification of the random field associated with the elastic properties in the so-called interphase region. For illustration purposes, a prototypical polymer system reinforced by a Silica nanoscopic inclusion is considered. Molecular Dynamics (MD) simulations are first performed and used to characterize the conformational properties of the polymer chains in the neighborhood of the inclusion. It is shown that these chains are characterized by a specific tangential orientation which, together with the density profile and variations in chain mobility, allows for the geometric definition of the interphase region. Mechanical virtual testing is next completed on a set of initial configurations, hence providing a simulated database for model calibration. The results thus obtained are subsequently used to construct a random field model for the interphase stiffness. An inverse calibration procedure is finally proposed and relies on a stated equivalence between the apparent properties obtained from MD simulations and those computed by numerical homogenization in the continuum mechanics formulation. The interphase elasticity random field is seen to exhibit nonnegligible fluctuations, and the estimates of parameters related to spatial correlation are shown to be consistent with characteristic lengths of the atomistic model, such as the interphase thickness.",10.1016/j.cma.2015.10.006,https://dx.doi.org/10.1016/j.cma.2015.10.006
"Yan, K | Cheng, GD | Wang, BP",2016,Adjoint methods of sensitivity analysis for Lyapunov equation,Applications_STRUCTURAL AND MULTIDISCIPLINARY OPTIMIZATION,5,2.5,"The existing direct sensitivity analysis of optimal structural vibration control based on Lyapunov's second-method is computationally expensive when applied to finite element models with a large number of degree-of-freedom and design variables. A new adjoint sensitivity analysis method is proposed in this paper. Using the new method the sensitivity of the performance index, a time integral of a quadratic function of state variables, with respect to all design variables is calculated by solving two Lyapunov matrix equations. In consideration of computational cost reduction, the new adjoint method is further extended to the reduced order model by Guyan method. This makes the method applicable to large finite element models. Two numerical examples demonstrate the accuracy and efficiency of the proposed method.",10.1007/s00158-015-1323-z,https://dx.doi.org/10.1007/s00158-015-1323-z
"Silva, CAC | Bittencourt, ML",2000,An object-oriented structural optimization program,Applications_STRUCTURAL AND MULTIDISCIPLINARY OPTIMIZATION,5,0.28,"In this paper, implementation concepts of a structural optimization software using object-oriented programming (OOP) in CS ++ is presented. A brief mathematical formulation of structural optimization and continuum-based sensitivity analysis is presented. The requirements of a computational optimization environment are derived from this formulation. The OOP characteristics are analysed and this paradigm is employed in the implementation of design variables, structural performance functionals, velocity fields, design model and mathematical programming algorithms using CI-Jr. Finally, the program obtained is applied to D linear elastic examples of sizing and shape optimization.",10.1007/s001580050146,https://dx.doi.org/10.1007/s001580050146
"Cardoso, JB | Sousa, LG | Castro, JA | Valido, AJ",2002,Optimal design of laminated composite beam structures,Applications_STRUCTURAL AND MULTIDISCIPLINARY OPTIMIZATION,5,0.31,"This work deals with design sensitivity analysis and optimal design of composite structures modelled as thin-walled beams. The structures are treated as a torsion-bending resistant beams. The analysis problem is discretized by a finite element technique. A two-node Hermitean beam element is used. The beam sections are made from an assembly of elements that correspond to flat layered laminated composite panels. Optimal design is performed with respect to the lamina orientations and thickness of the laminates. The structural weight is considered as the objective function. Constraints are imposed on stresses, displacements, critical load and natural frequencies. Two failure criteria are used to limit the structural strength: Tsai-Hill and maximum stress. The Tsai-Hill criterion is also adopted to predict the first-ply-failure loads. The design sensitivity analysis is analytically formulated and implemented. An adjoint variable method is used to derive the response sensitivities with respect to the design. A mathematical programming approach is used for the optimization process. Numerical examples are performed on three-dimensional structures.",10.1007/s00158-002-0230-2,https://dx.doi.org/10.1007/s00158-002-0230-2
"Liu, T | Li, B | Wang, ST | Gao, L",2014,Eigenvalue topology optimization of structures using a parameterized level set method,Applications_STRUCTURAL AND MULTIDISCIPLINARY OPTIMIZATION,5,1.25,"Preventing a structure from resonance is important in many real-world applications. Because an external excitation frequency can be lower than the fundamental eigenfrequency or between the eigenfrequencies of a structure, there is a strong need for eigenfrequency optimization technology to optimize the fundamental eigenfrequency and, in addition, the k-th eigenfrequency and to maximize the gap between eigenfrequencies. However, previous optimization studies on vibrating elastic structures that used the level set method have been devoted to the optimization of the fundamental eigenfrequency, whereas the higher-order eigenfrequencies optimization problem has seldom been considered. This paper presents an eigenfrequency optimization technology that is based on the compactly supported radial basis functions (CS-RBFs) parameterized level-set method, using the fundamental eigenfrequency, the eigenfrequency of a given higher-order, and the gap between two consecutive eigenfrequencies as the optimization objectives. Furthermore, to address the oscillation problem of the objective function, we adopt an exponential weighted optimization model of a number of the lower eigenfrequencies for multiple eigenvalue optimizations, and we utilize mode-tracking technology for the single eigenvalue optimization.In addition, we further extend the CS-RBFs parameterized level-set method to an optimization that is performed with geometric constraints, which means that the size and position of the regular holes in the structure can be optimized with the shape and topology. This approach is useful in real-world applications. The effectiveness of this method is demonstrated by several widely investigated examples that have various objectives.",10.1007/s00158-014-1069-z,https://dx.doi.org/10.1007/s00158-014-1069-z
