AU,year,title,journal,citations,Avg. Citations,abstract,DOI,DOI link
"Ghosh, D | Avery, P | Farhat, C",2009,An FETI-preconditioned conjuerate gradient method for large-scale stochastic finite element problems,Applications_INTERNATIONAL JOURNAL FOR NUMERICAL METHODS IN ENGINEERING,26,2.89,"In the spectral stochastic finite element method for analyzing an uncertain system. the uncertainty is represented by a set of random variables, and a quantity of Interest such as the system response is considered as a function of these random variables Consequently, the underlying Galerkin projection yields a block system of deterministic equations where the blocks are sparse but coupled. The solution of this algebraic system of equations becomes rapidly challenging when the size of the physical system and/or the level of uncertainty is increased This paper addresses this challenge by presenting a preconditioned conjugate gradient method for such block systems where the preconditioning step is based on the dual-primal finite element tearing and interconnecting method equipped with a Krylov subspace reusage technique for accelerating the iterative solution of systems with multiple and repeated right-hand sides. Preliminary performance results on a Linux Cluster suggest that the proposed Solution method is numerically scalable and demonstrate its potential for making the uncertainty quantification Of realistic systems tractable.",10.1002/nme.2595,https://dx.doi.org/10.1002/nme.2595
"Moreo, P | Perez, MA | Garcia-Aznar, JM | Doblare, M",2007,Modelling the mechanical behaviour of living bony interfaces,Applications_COMPUTER METHODS IN APPLIED MECHANICS AND ENGINEERING,26,2.36,"The main purpose of this work is to develop a computational model for living interfaces with bone implants. The model is able to qualitatively capture the evolutive behaviour of bony interfaces: deterioration and bone ingrowth. We assume that the evolution of the variables that define the mechanical state of the interface can be formulated following the principles of continuum damage mechanics (CDM) with the additional feature that the variation of the internal variables may be negative to allow the interface to osseointegrate partially (repair) recovering its initial stiffness. Within the present study, the femoral component of total hip non-cemented arthroplasties has been analyzed by means of D finite element analysis (FEA). The dependence of the bone ingrowth pattern on the stem stiffness has been studied, concluding that stiffer stems improve primary fixation. Moreover, a sensitivity analysis has been performed studying the influence of patient activity, stem surface finishing and other model parameters. Overall, the model is able to reproduce the progressive deterioration and osseointegration of living bony interfaces, obtaining results that qualitatively agree with clinical observations.",10.1016/j.cma.2007.03.020,https://dx.doi.org/10.1016/j.cma.2007.03.020
"Wei, LY | Tang, TB | Xie, XH | Shen, WJ",2011,Truss optimization on shape and sizing with frequency constraints based on parallel genetic algorithm,Applications_STRUCTURAL AND MULTIDISCIPLINARY OPTIMIZATION,26,3.71,"Truss shape and sizing optimization under frequency constraints is extremely useful when improving the dynamic performance of structures. However, coupling of two different types of design variables, nodal coordinates and cross-sectional areas, often lead to slow convergence or even divergence. Because shape and sizing variables coupled increase the number of design variables and the changes of shape and sizing variables are of widely different orders of magnitude. Otherwise, multiple frequency constraints often cause difficult dynamic sensitivity analysis. Thus optimal criteria and mathematical programming methods have considerable limitations on solving the problems because of needing complex dynamic sensitivity analysis and being easily trapped into the local optima. Genetic Algorithms (GAs) show great potentials to solve the truss shape and sizing optimization problems. Since GAs adopt global probabilistic population search techniques and require no gradient information. The improved genetic algorithms can effectively increase the solution quality. However, the serial GA is computationally expensive and is limited on gaining higher quality solutions. To solve the truss shape and sizing optimization problems with frequency constraints more effectively and efficiently, a Niche Hybrid Parallel Genetic Algorithm (NHPGA) is proposed to significantly reduce the computational cost and to further improve solution quality. The NHPGA is to blend the advantages of parallel computing, simplex search and genetic algorithm with niche technique. Several typical truss optimization examples demonstrate that NHPGA can significantly reduce computing time and attain higher quality solutions. It also suggests that the NHPGA provide a potential algorithm architecture, which effectively combines the robust and global search characteristics of genetic algorithm, strong exploitation ability of simplex search and computational speedup property of parallel computing.",10.1007/s00158-010-0600-0,https://dx.doi.org/10.1007/s00158-010-0600-0
"Cho, S | Choi, KK",2000,Design sensitivity analysis and optimization of non-linear transient dynamics. Part I - sizing design,Applications_INTERNATIONAL JOURNAL FOR NUMERICAL METHODS IN ENGINEERING,26,1.44,"A continuum-based sizing design sensitivity analysis (DSA) method is presented for the transient dynamic response of non-linear structural systems with elastic-plastic material and large deformation. The methodology is aimed for applications in non-linear dynamic problems, such as crashworthiness design. The first-order variations of the energy forms, load form, and kinematic and structural responses with respect to sizing design Variables are derived. To obtain design sensitivities, the direct differentiation method and updated Lagrangian formulation are used since they are more appropriate for the path-dependent problems than the adjoint variable method and the total Lagrangian formulation, respectively. The central difference method and the finite element method are used to discretize the temporal and spatial domains, respectively. The Hughes-Liu truss/beam element, Jaumann rate of Cauchy stress, rate of deformation tensor, and Jaumann rate-based incrementally objective stress integration scheme are used to handle the finite strain and rotation. An elastic-plastic material model with combined isotropic/kinematic hardening rule is employed. A key development is to use the radial return algorithm along with the secant iteration method to enforce the consistency condition that prevents the discontinuity of stress sensitivities at the yield point. Numerical results of sizing DSA using DYNAD yield very good agreement with the finite difference results. Design optimization is carried out using the design sensitivity information.",10.1002/(SICI)1097-0207(20000530)48:3<351::AID-NME878>3.0.CO;2-P,https://dx.doi.org/10.1002/(SICI)1097-0207(20000530)48:3<351::AID-NME878>3.0.CO;2-P
"Park, HM | Shin, HJ",2003,Shape identification for natural convection problems using the adjoint variable method,Applications_JOURNAL OF COMPUTATIONAL PHYSICS,25,1.67,"An inverse geometry problem is investigated to identify the boundary shape of a domain from temperature measurements on the other boundary, where the temperature field is dominated by natural convection. The potential applications of the present investigation are the determination of a phase change isotherm in the Bridgman crystal growth or the thermal tomography which detects flaws in materials nondestructively. The inverse problem is posed as a minimization problem of the performance function, which is the sum of square residuals between calculated and observed temperature, by means of a conjugate gradient method employing the adjoint variable method. The present method is found to identify the domains reasonably accurately even with noisy temperature measurements.",10.1016/S0021-9991(03)00046-9,https://dx.doi.org/10.1016/S0021-9991(03)00046-9
"Vikhansky, A | Kraft, M",2004,A Monte Carlo methods for identification and sensitivity analysis of coagulation processes,Applications_JOURNAL OF COMPUTATIONAL PHYSICS,25,1.79,"A stochastic simulation algorithm is presented to calculate parametric derivatives of solutions of a population balance equation. The dispersed system is approximated by an N-particle stochastic weighted ensemble. The derivatives are accounted for through infinitesimal deviation of the statistical weights that are recalculated at each coagulation. Thus, all the parametric derivatives can be calculated along one trajectory of the process, given N sufficiently large. We use an operator-splitting technique to account for surface growth of the particles. The obtained solution is in good agreement with the available analytical solutions. As soon as the parametric derivatives are known the gradient-based methods can be applied to the control and identification of the coagulation process. The extension of the proposed technique to a multi-dimensional case is straightforward.",10.1016/j.jcp.2004.03.006,https://dx.doi.org/10.1016/j.jcp.2004.03.006
"Chen, XH | Chen, X",2003,Sensitivity analysis and determination of streambed leakance and aquifer hydraulic properties,Applications_JOURNAL OF HYDROLOGY,25,1.67,"A nonlinear regression method is used to calculate the hydraulic parameters of a stream-aquifer system using pumping test data. Five parameters, including the horizontal hydraulic conductivity (K(x)), aquifer anisotropy (K(a)), streambed leakance l, aquifer specific storage S(s), and specific yield S(y), can be calculated. MODFLOW, coupled to the regression method, simulates the groundwater flow that is affected by streams. Sensitivity analyses indicate that for a given stream-aquifer system, the quality of the stream-aquifer test data can be improved through a careful selection of observation and pumping wells, as well as an appropriate test duration. An optimal location of an observation well is where the magnitude of the sensitivities is enhanced and the correlation of the transient sensitivities of two parameters is reduced. Generally, a longer pumping period will increase the sensitivity for l and K(x) and reduce the correlation between S(y) and K(x) and between S(y) and l. Results from hypothetical examples and a field test suggest that a two-well analysis of pumping test data can significantly reduce the correlation of sensitivity coefficients; as a result, convergence occurs faster and the estimated standard errors are reduced.",10.1016/j.jhydrol.2003.08.004,https://dx.doi.org/10.1016/j.jhydrol.2003.08.004
"Yeh, HD | Chen, YJ",2007,Determination of skin and aquifer parameters for a slug test with wellbore-skin effect,Applications_JOURNAL OF HYDROLOGY,25,2.27,"Slug test is considered to reflect the hydraulic parameters in the vicinity of the test well. The aquifer parameters are usually identified by fitting an appropriate mathematical solution or graphical type curves with slug test data. In this paper, we developed an approach by combining [Moench, A.F., Hsieh, P.A., . Analysis of slug test data in a well with finite-thickness skin. In: Memoirs of the th International Congress on the Hydrogeology of Rocks of Low Permeability, U.S.A. Members of the International Association of Hydrologists, Tucson, AZ, vol. , pp. -] and simulated annealing (SA) approach to estimate five parameters, i.e., three skin parameters and two aquifer parameters. The three skin parameters are hydraulic conductivity, specific storage, and thickness of the wellbore-skin zone, white the two aquifer parameters are hydraulic conductivity and specific storage of the formation zone. It is worthy to note although the thickness of the wellbore-skin zone is usually taken as an input data for the data-analyzed software, it is actually an unknown parameter that cannot be measured directly. This paper proposes a methodology for estimating the thickness of the wellbore-skin zone with other hydraulic parameters at the same time. Eight sets of well water-level. (WWL) data of aquifers with both positive and negative skins are generated by Moench and Hsieh [Moench and Hsieh, ] and four sets of standard normally distributed noise are then added to each set of WWL data. The results indicate that the negative-skin cases generally give a better estimated result than that of the positive-skin cases. Sensitivity analysis is also employed to demonstrate the physical behavior when slug test was performed under positive-skin effect. For the case of an aquifer with a positive-skin, the use of a longer series of WWL data for analysis is strongly recommended for better estimation of aquifer hydraulic conductivity. Analyzing the WWL data of the test and observation wells simultaneously could significantly improve the estimations on specific storages. Impetuously presuming an arbitrary value for the thickness of the wellbore-skin zone may lead to poor estimation for the other four parameters.",10.1016/j.jhydrol.2007.05.029,https://dx.doi.org/10.1016/j.jhydrol.2007.05.029
"Vanrolleghem, PA | Mannina, G | Cosenza, A | Neumann, MB",2015,"Global sensitivity analysis for urban water quality modelling: Terminology, convergence and comparison of different methods",Applications_JOURNAL OF HYDROLOGY,25,8.33,"Sensitivity analysis represents an important step in improving the understanding and use of environmental models. Indeed, by means of global sensitivity analysis (GSA), modellers may identify both important (factor prioritisation) and non-influential (factor fixing) model factors. No general rule has yet been defined for verifying the convergence of the GSA methods. In order to fill this gap this paper presents a convergence analysis of three widely used GSA methods (SRC, Extended FAST and Morris screening) for an urban drainage stormwater quality-quantity model. After the convergence was achieved the results of each method were compared. In particular, a discussion on peculiarities, applicability, and reliability of the three methods is presented. Moreover, a graphical Venn diagram based classification scheme and a precise terminology for better identifying important, interacting and non-influential factors for each method is proposed. In terms of convergence, it was shown that sensitivity indices related to factors of the quantity model achieve convergence faster. Results for the Morris screening method deviated considerably from the other methods. Factors related to the quality model require a much higher number of simulations than the number suggested in literature for achieving convergence with this method. In fact, the results have shown that the term ""screening"" is improperly used as the method may exclude important factors from further analysis. Moreover, for the presented application the convergence analysis shows more stable sensitivity coefficients for the Extended-FAST method compared to SRC and Morris screening. Substantial agreement in terms of factor fixing was found between the Morris screening and Extended FAST methods. In general, the water quality related factors exhibited more important interactions than factors related to water quantity. Furthermore, in contrast to water quantity model outputs, water quality model outputs were found to be characterised by high non-linearity.",10.1016/j.jhydrol.2014.12.056,https://dx.doi.org/10.1016/j.jhydrol.2014.12.056
"Yadav, V | Rahman, S",2014,Adaptive-sparse polynomial dimensional decomposition methods for high-dimensional stochastic computing,Applications_COMPUTER METHODS IN APPLIED MECHANICS AND ENGINEERING,25,6.25,"This article presents two novel adaptive-sparse polynomial dimensional decomposition (PDD) methods for solving high-dimensional uncertainty quantification problems in computational science and engineering. The methods entail global sensitivity analysis for retaining important PDD component functions, and a full- or sparse-grid dimension-reduction integration or quasi Monte Carlo simulation for estimating the PDD expansion coefficients. A unified algorithm, endowed with two distinct ranking schemes for grading component functions, was created for their numerical implementation. The fully adaptive-sparse PDD method is comprehensive and rigorous, leading to the second-moment statistics of a stochastic response that converges to the exact solution when the tolerances vanish. A partially adaptive-sparse PDD method, obtained through regulated adaptivity and sparsity, is economical and is, therefore, expected to solve practical problems with numerous variables. Compared with past developments, the adaptive-sparse PDD methods do not require their truncation parameter(s) to be assigned a priori or arbitrarily. The numerical results reveal that an adaptive-sparse PDD method achieves a desired level of accuracy with considerably fewer coefficients compared with existing PDD approximations. For a required accuracy in calculating the probabilistic response characteristics, the new bivariate adaptive-sparse PDD method is more efficient than the existing bivariately truncated PDD method by almost an order of magnitude. Finally, stochastic dynamic analysis of a disk brake system was performed, demonstrating the ability of the new methods to tackle practical engineering problems.",10.1016/j.cma.2014.01.027,https://dx.doi.org/10.1016/j.cma.2014.01.027
"Kang, Z | Wang, R | Tong, LY",2011,Combined optimization of bi-material structural layout and voltage distribution for in-plane piezoelectric actuation,Applications_COMPUTER METHODS IN APPLIED MECHANICS AND ENGINEERING,25,3.57,"This paper investigates the combined optimization of bi-material structural layout and actuation voltage distribution of structures with embedded in-plane piezoelectric actuators. The maximization of the nodal displacement at a selected output port is considered as the design objective. A two-phase material model with power-law penalization is employed in the topology optimization of the actuator elements and the coupled surrounding structure. In order to incorporate the actuation voltage directly into the design for achieving the best overall actuation performance, element-wise voltage design variables are also included in the optimization. For the purpose of easy implementation of the electric system, the allowable voltage levels at an individual element are confined to three discrete values, namely zero and two prescribed values with opposite signs. To this end, a special interpolation scheme between the tri-level voltage values and the design variables is used in the optimization model. Based on the design sensitivity analysis of the objective function, the combined optimization problem is solved with the MMA algorithm. Numerical examples are presented to demonstrate the applicability of the proposed optimization model and numerical techniques. The optimal solutions also confirmed that larger output displacement can be achieved by introducing voltage design variables into the design problem.",10.1016/j.cma.2011.01.005,https://dx.doi.org/10.1016/j.cma.2011.01.005
"Congedo, PM | Corre, C | Martinez, JM",2011,Shape optimization of an airfoil in a BZT flow with multiple-source uncertainties,Applications_COMPUTER METHODS IN APPLIED MECHANICS AND ENGINEERING,25,3.57,"Bethe-Zel'dovich-Thompson fluids (BZT) are characterized by negative values of the fundamental derivative of gasdynamics for a range of temperatures and pressures in the vapor phase, which leads to non-classical gasdynamic behaviors such as the disintegration of compression shocks. These non-classical phenomena can be exploited, when using these fluids in Organic Rankine Cycles (ORCs), to increase isentropic efficiency. A predictive numerical simulation of these flows must account for two main sources of physical uncertainties: the BZT fluid properties often difficult to measure accurately and the usually fluctuating turbine inlet conditions. For taking full advantage of the BZT properties, the turbine geometry must also be specifically designed, keeping in mind the geometry achieved in practice after machining always slightly differs from the theoretical shape. This paper investigates some efficient procedures to perform shape optimization in a D BZT flow with multiple-source uncertainties (thermodynamic model, operating conditions and geometry). To demonstrate the feasibility of the proposed efficient strategies for shape optimization in the presence of multiple-source uncertainties, a zero incidence symmetric airfoil wave-drag minimization problem is retained as a case-study. This simplified configuration encompasses most of the features associated with a turbine design problem, as far the uncertainty quantification is concerned. A preliminary analysis of the contributions to the variance of the wave-drag allows to select the most significant sources of uncertainties using a reduced number of flow computations. The resulting mean value and variance of the objective are next turned into rnetamodels. The optimal Pareto sets corresponding to the minimization of various substitute functions are obtained using a genetic algorithm as optimizer and their differences are discussed.",10.1016/j.cma.2010.08.006,https://dx.doi.org/10.1016/j.cma.2010.08.006
"Doltsinis, I | Kang, Z",2006,Perturbation-based stochastic FE analysis and robust design of inelastic deformation processes,Applications_COMPUTER METHODS IN APPLIED MECHANICS AND ENGINEERING,25,2.08,"The study addresses the perturbation-based stochastic finite element analysis and the robust design optimization of deformation processes of inelastic solids. The perturbation equations for the stochastic moment analysis of both steady-state and non-stationary processes are presented. An iteration scheme based on the secant system operator is given for the solution of the perturbation equations in case that a tangent matrix is not available, The robust design of deformation processes is stated as a two-criteria optimal design problem that attempts best mean properties of the outcome at minimum variability. The task is solved using optimization techniques based on sequential quadratic programming in conjunction with the stochastic finite element analysis. The proposed method is applied to the design of an extrusion die for robustness with respect to friction variability, and to a workpiece preform design problem. The numerical results show the potential of the method for applications regarding the design of robust deformation processes.",10.1016/j.cma.2005.05.004,https://dx.doi.org/10.1016/j.cma.2005.05.004
"Chen, BS | Tong, LY",2005,Thermomechanically coupled sensitivity analysis and design optimization of functionally graded materials,Applications_COMPUTER METHODS IN APPLIED MECHANICS AND ENGINEERING,25,1.92,"This paper presents a systematic numerical technique for performing sensitivity analysis of coupled thermomechanical problem of functionally graded materials (FGMs). General formulations are presented based on finite element model by using the direct method and the adjoint method. In the modeling of spatial variances of material properties, the graded finite element method is employed to conduct the heat transfer analysis and structural analysis and their sensitivity analysis. The design variables are the volume fractions of FGMs constituents and structural shape parameters. The design optimization model is then constructed and solved by the sequential linear programming (SLP). Numerical examples are presented to demonstrate the accuracy and the applicability of the present method.",10.1016/j.cma.2004.07.005,https://dx.doi.org/10.1016/j.cma.2004.07.005
"Lee, C | Cao, J",2001,Shell element formulation of multi-step inverse analysis for axisymmetric deep drawing process,Applications_INTERNATIONAL JOURNAL FOR NUMERICAL METHODS IN ENGINEERING,25,1.47,"Inverse analysis today is generally performed with membrane models in analysing sheet metal forming processes. Given the final desired configuration, it usually estimates the deformation in a one-step calculation. However, for some practical problems where the bending effect is significant and the strain history departs from a linear path, this calculation becomes not good enough to provide the optimal design values. In this paper, an axisymmetric shell element for the multi-step inverse analysis is developed for more accurate pre diction of design variables such as the initial blank shape, strain distributions, and intermediate shapes, etc. The algorithm has been applied to deep drawing processes for both thin and relatively thick sheet metal. Numerical examples demonstrate that the proposed combination of shell element and multi-step inverse analysis can provide more precise results than the previous algorithms used in inverse analysis.",10.1002/1097-0207(20010130)50:3<681::AID-NME45>3.0.CO;2-M,https://dx.doi.org/10.1002/1097-0207(20010130)50:3<681::AID-NME45>3.0.CO;2-M
